reference,verse,url,match,likely,most_unusual_phrase,token_count,proportion,tfidf,tf,position_range,position_sd,page,runs_pval
Psalm 14:2 (KJV),"The LORD looked down from heaven upon the children of men, to see if there were any that did understand, and seek God.",http://chroniclingamerica.loc.gov/lccn/sn86069456/1907-02-01/ed-1/seq-1/#words=lord+looked+down+heaven+upon+children+men+see+were+any+did+understand+seek+god,,no,if were any,1,0.0138888888888889,0.256844864336477,0.0277777777777778,NA,NA,sn86069456/1907-02-01/ed-1/seq-1/,0.987687396720633
Acts 19:7 (KJV),And all the men were about twelve.,http://chroniclingamerica.loc.gov/lccn/sn86069643/1912-08-29/ed-1/seq-3/#words=all+men+were+about+twelve,,yes,all men were,1,0.333333333333333,2.91186316411573,0.333333333333333,NA,NA,sn86069643/1912-08-29/ed-1/seq-3/,0.989292149581852
Exodus 10:27 (KJV),"But the LORD hardened Pharaoh's heart, and he would not let them go.",http://chroniclingamerica.loc.gov/lccn/sn86053067/1869-09-09/ed-1/seq-1/#words=lord+hardened+pharaoh's+heart+would+let+go,,possibly,not let them,1,0.0588235294117647,0.503133407973719,0.0588235294117647,NA,NA,sn86053067/1869-09-09/ed-1/seq-1/,0.987417062912241
Numbers 10:30 (KJV),"And he said unto him, I will not go; but I will depart to mine own land, and to my kindred.",http://chroniclingamerica.loc.gov/lccn/sn84026853/1876-04-19/ed-1/seq-3/#words=said+unto+i+go+i+depart+mine+own+land+my+kindred,,possibly,him not go,1,0.0526315789473684,0.471512265455863,0.0526315789473684,NA,NA,sn84026853/1876-04-19/ed-1/seq-3/,0.993353922838573
Luke 6:31 (KJV),"And as ye would that men should do to you, do ye also to them likewise.",http://chroniclingamerica.loc.gov/lccn/sn85033535/1874-06-06/ed-1/seq-3/#words=ye+would+men+should+you+ye+also+likewise,,yes,would men should,3,0.2,1.84928302322263,0.2,3,1.52752523165195,sn85033535/1874-06-06/ed-1/seq-3/,0
Matthew 26:9 (KJV),"For this ointment might have been sold for much, and given to the poor.",http://chroniclingamerica.loc.gov/lccn/sn87076843/1874-01-23/ed-1/seq-4/#words=ointment+might+been+sold+much+given+poor,,possibly,have been sold,1,0.0666666666666667,0.616427674407545,0.0666666666666667,NA,NA,sn87076843/1874-01-23/ed-1/seq-4/,0.992925302305469
Matthew 6:29 (KJV),"And yet I say unto you, That even Solomon in all his glory was not arrayed like one of these.",http://chroniclingamerica.loc.gov/lccn/sn96091104/1885-07-10/ed-1/seq-2/#words=yet+i+say+unto+you+even+solomon+all+glory+arrayed+like+one,,yes,glory not arrayed like one,12,0.571428571428571,5.2836657806361,0.571428571428571,12,3.75277674973257,sn96091104/1885-07-10/ed-1/seq-2/,0
Deuteronomy 1:32 (KJV),"Yet in this thing ye did not believe the LORD your God,",http://chroniclingamerica.loc.gov/lccn/sn86069162/1903-02-04/ed-1/seq-4/#words=yet+thing+ye+did+believe+lord+your+god,,possibly,did not believe,1,0.0625,0.545974343271699,0.0625,NA,NA,sn86069162/1903-02-04/ed-1/seq-4/,0.98903124084564
Luke 6:31 (KJV),"And as ye would that men should do to you, do ye also to them likewise.",http://chroniclingamerica.loc.gov/lccn/sn84038125/1876-07-21/ed-1/seq-1/#words=ye+would+men+should+you+ye+also+likewise,,yes,men should ye,6,0.4,3.69856604644527,0.4,6,2.16024689946929,sn84038125/1876-07-21/ed-1/seq-1/,0
Luke 17:6 (KJV),"And the Lord said, If ye had faith as a grain of mustard seed, ye might say unto this sycamine tree, Be thou plucked up by the root, and be thou planted in the sea; and it should obey you.",http://chroniclingamerica.loc.gov/lccn/sn84023209/1874-05-20/ed-1/seq-1/#words=lord+said+ye+had+faith+grain+mustard+seed+ye+might+say+unto+sycamine+tree+thou+plucked+up+root+thou+planted+sea+should+obey+you,,no,grain mustard seed,1,0.0169491525423729,0.144970642975478,0.0169491525423729,NA,NA,sn84023209/1874-05-20/ed-1/seq-1/,0.992214864956642
Romans 15:27 (KJV),"It hath pleased them verily; and their debtors they are. For if the Gentiles have been made partakers of their spiritual things, their duty is also to minister unto them in carnal things.",http://chroniclingamerica.loc.gov/lccn/2010270511/1893-06-25/ed-1/seq-8/#words=hath+pleased+verily+debtors+gentiles+been+made+partakers+spiritual+things+duty+also+minister+unto+carnal+things,,no,have been made,1,0.0196078431372549,0.175661432228655,0.0196078431372549,NA,NA,2010270511/1893-06-25/ed-1/seq-8/,0.986630866379621
2 Timothy 4:6 (KJV),"For I am now ready to be offered, and the time of my departure is at hand.",http://chroniclingamerica.loc.gov/lccn/sn86069620/1899-04-13/ed-1/seq-2/#words=i+am+now+ready+offered+time+my+departure+hand,,yes,now ready offered,3,0.25,2.41297005605533,0.25,3,1.52752523165195,sn86069620/1899-04-13/ed-1/seq-2/,0
Psalm 119:100 (KJV),"I understand more than the ancients, because I keep thy precepts.",http://chroniclingamerica.loc.gov/lccn/sn85038115/1885-02-17/ed-1/seq-1/#words=i+understand+more+than+ancients+because+i+keep+thy+precepts,,possibly,understand more than,1,0.0666666666666667,0.643458681614756,0.0666666666666667,NA,NA,sn85038115/1885-02-17/ed-1/seq-1/,0.991099567923001
Isaiah 31:7 (KJV),"For in that day every man shall cast away his idols of silver, and his idols of gold, which your own hands have made unto you for a sin.",http://chroniclingamerica.loc.gov/lccn/sn85025007/1860-12-06/ed-1/seq-4/#words=day+every+man+shall+cast+away+idols+silver+idols+gold+your+own+hands+made+unto+you+sin,,possibly,your own hands have,3,0.0681818181818182,0.648867626467178,0.0681818181818182,3,1.52752523165195,sn85025007/1860-12-06/ed-1/seq-4/,0
Exodus 10:27 (KJV),"But the LORD hardened Pharaoh's heart, and he would not let them go.",http://chroniclingamerica.loc.gov/lccn/sn83032199/1874-11-11/ed-1/seq-1/#words=lord+hardened+pharaoh's+heart+would+let+go,,possibly,would not let,1,0.0588235294117647,0.503133407973719,0.0588235294117647,NA,NA,sn83032199/1874-11-11/ed-1/seq-1/,0.992523463760661
Nehemiah 2:3 (KJV),"And said unto the king, Let the king live for ever: why should not my countenance be sad, when the city, the place of my fathers' sepulchres, lieth waste, and the gates thereof are consumed with fire?",http://chroniclingamerica.loc.gov/lccn/sn83030272/1908-12-06/ed-1/seq-5/#words=said+unto+king+let+king+live+ever+why+should+my+countenance+sad+when+city+place+my+fathers+sepulchres+lieth+waste+gates+thereof+consumed+fire,,no,why should not,1,0.00847457627118644,0.156718900273105,0.0169491525423729,NA,NA,sn83030272/1908-12-06/ed-1/seq-5/,0.989751179413806
1 Timothy 2:4 (KJV),"Who will have all men to be saved, and to come unto the knowledge of the truth.",http://chroniclingamerica.loc.gov/lccn/sn84024283/1888-04-26/ed-1/seq-7/#words=all+men+saved+come+unto+knowledge+truth,,possibly,who have all,1,0.0555555555555556,0.536215568012296,0.0555555555555556,NA,NA,sn84024283/1888-04-26/ed-1/seq-7/,0.990828509182117
Luke 24:16 (KJV),But their eyes were holden that they should not know him.,http://chroniclingamerica.loc.gov/lccn/sn93051669/1898-05-17/ed-1/seq-18/#words=eyes+were+holden+should+know,,possibly,not know him,1,0.0833333333333333,0.804323352018445,0.0833333333333333,NA,NA,sn93051669/1898-05-17/ed-1/seq-18/,0.985134449593624
Mark 12:8 (KJV),"And they took him, and killed him, and cast him out of the vineyard.",http://chroniclingamerica.loc.gov/lccn/sn89058007/1895-09-27/ed-1/seq-4/#words=took+killed+cast+out+vineyard,,possibly,him cast him out,1,0.0769230769230769,0.711262701239475,0.0769230769230769,NA,NA,sn89058007/1895-09-27/ed-1/seq-4/,0
Matthew 25:29 (KJV),"For unto every one that hath shall be given, and he shall have abundance: but from him that hath not shall be taken away even that which he hath.",http://chroniclingamerica.loc.gov/lccn/sn90060625/1902-07-12/ed-1/seq-7/#words=unto+every+one+hath+shall+given+shall+abundance+hath+shall+taken+away+even+hath,,no,taken away even,1,0.0232558139534884,0.215032909677051,0.0232558139534884,NA,NA,sn90060625/1902-07-12/ed-1/seq-7/,0.987707140383288
Job 19:16 (KJV),"I called my servant, and he gave me no answer; I intreated him with my mouth.",http://chroniclingamerica.loc.gov/lccn/sn91068415/1921-05-12/ed-1/seq-7/#words=i+called+my+servant+gave+me+answer+i+intreated+my+mouth,,possibly,gave me no,1,0.0555555555555556,0.497707391314522,0.0555555555555556,NA,NA,sn91068415/1921-05-12/ed-1/seq-7/,0.987582722553454
Judges 16:5 (KJV),"And the lords of the Philistines came up unto her, and said unto her, Entice him, and see wherein his great strength lieth, and by what means we may prevail against him, that we may bind him to afflict him: and we will give thee every one of us eleven hundred pieces of silver.",http://chroniclingamerica.loc.gov/lccn/sn85033429/1869-08-26/ed-1/seq-3/#words=lords+philistines+came+up+unto+said+unto+entice+see+wherein+great+strength+lieth+what+means+we+may+prevail+against+we+may+bind+afflict+we+give+thee+every+one+us+eleven+hundred+pieces+silver,,no,every one us,1,0.0108695652173913,0.0929703036473177,0.0108695652173913,NA,NA,sn85033429/1869-08-26/ed-1/seq-3/,0.991981295923646
Mark 3:12 (KJV),And he straitly charged them that they should not make him known.,http://chroniclingamerica.loc.gov/lccn/sn84026497/1889-10-16/ed-1/seq-2/#words=straitly+charged+should+make+known,,possibly,should not make,1,0.0769230769230769,0.711262701239475,0.0769230769230769,NA,NA,sn84026497/1889-10-16/ed-1/seq-2/,0.986650528487183
Isaiah 10:29 (KJV),They are gone over the passage: they have taken up their lodging at Geba; Ramah is afraid; Gibeah of Saul is fled.,http://chroniclingamerica.loc.gov/lccn/sn85026050/1864-12-16/ed-1/seq-1/#words=gone+over+passage+taken+up+lodging+geba+ramah+afraid+gibeah+saul+fled,,no,have taken up,1,0.0333333333333333,0.321729340807378,0.0333333333333333,NA,NA,sn85026050/1864-12-16/ed-1/seq-1/,0.992118032683859
1 Chronicles 24:28 (KJV),"Of Mahli came Eleazar, who had no sons.",http://chroniclingamerica.loc.gov/lccn/sn85034467/1859-05-05/ed-1/seq-1/#words=mahli+came+eleazar+had+sons,,possibly,who had no,1,0.0909090909090909,0.877443656747394,0.0909090909090909,NA,NA,sn85034467/1859-05-05/ed-1/seq-1/,0.988658598922465
Romans 7:15 (KJV),"For that which I do I allow not: for what I would, that do I not; but what I hate, that do I.",http://chroniclingamerica.loc.gov/lccn/sn94052364/1890-04-26/ed-1/seq-2/#words=i+i+allow+what+i+would+i+what+i+hate+i,,possibly,not would not,1,0.111111111111111,1.07243113602459,0.111111111111111,NA,NA,sn94052364/1890-04-26/ed-1/seq-2/,0.991942751919906
2 Corinthians 12:16 (KJV),"But be it so, I did not burden you: nevertheless, being crafty, I caught you with guile.",http://chroniclingamerica.loc.gov/lccn/sn84026688/1898-02-03/ed-1/seq-1/#words=so+i+did+burden+you+nevertheless+being+crafty+i+caught+you+guile,,possibly,so did not,1,0.0555555555555556,0.513689728672954,0.0555555555555556,NA,NA,sn84026688/1898-02-03/ed-1/seq-1/,0.988990593154913
Psalm 111:6 (KJV),"He hath shewed his people the power of his works, that he may give them the heritage of the heathen.",http://chroniclingamerica.loc.gov/lccn/sn85026050/1864-09-30/ed-1/seq-2/#words=hath+shewed+people+power+works+may+give+heritage+heathen,,no,may give them,1,0.0476190476190476,0.45961334401054,0.0476190476190476,NA,NA,sn85026050/1864-09-30/ed-1/seq-2/,0.992076166141105
1 Samuel 6:9 (KJV),"And see, if it goeth up by the way of his own coast to Beth-shemesh, then he hath done us this great evil: but if not, then we shall know that is not his hand that smote us; it was a chance that happened to us.",http://chroniclingamerica.loc.gov/lccn/sn88064402/1918-06-14/ed-1/seq-4/#words=see+goeth+up+way+own+coast+beth+shemesh+hath+done+us+great+evil+we+shall+know+hand+smote+us+chance+happened+us,,no,then we shall,1,0.0133333333333333,0.123285534881509,0.0133333333333333,NA,NA,sn88064402/1918-06-14/ed-1/seq-4/,0.986717288625752
2 Samuel 22:12 (KJV),"And he made darkness pavilions round about him, dark waters, and thick clouds of the skies.",http://chroniclingamerica.loc.gov/lccn/sn82016419/1880-07-16/ed-1/seq-1/#words=made+darkness+pavilions+round+about+dark+waters+thick+clouds+skies,,yes,dark waters thick clouds,6,0.260869565217391,2.3996003749664,0.260869565217391,18,5.88379534136323,sn82016419/1880-07-16/ed-1/seq-1/,0
Luke 18:25 (KJV),"For it is easier for a camel to go through a needle's eye, than for a rich man to enter into the kingdom of God.",http://chroniclingamerica.loc.gov/lccn/sn85038102/1898-04-29/ed-1/seq-6/#words=easier+camel+go+through+needle's+eye+than+rich+man+enter+kingdom+god,,yes,through needle's eye than rich,18,0.692307692307692,6.57543289668247,0.692307692307692,27,6.64338038380888,sn85038102/1898-04-29/ed-1/seq-6/,0
Matthew 16:26 (KJV),"For what is a man profited, if he shall gain the whole world, and lose his own soul? or what shall a man give in exchange for his soul?",http://chroniclingamerica.loc.gov/lccn/sn87075048/1900-06-21/ed-1/seq-2/#words=what+man+profited+shall+gain+whole+world+lose+own+soul+what+shall+man+give+exchange+soul,,yes,lose own soul shall,9,0.25,2.33740136935809,0.25,9,2.93446947694317,sn87075048/1900-06-21/ed-1/seq-2/,0
Numbers 10:30 (KJV),"And he said unto him, I will not go; but I will depart to mine own land, and to my kindred.",http://chroniclingamerica.loc.gov/lccn/sn86061215/1912-04-06/ed-1/seq-6/#words=said+unto+i+go+i+depart+mine+own+land+my+kindred,,possibly,him not go,1,0.0526315789473684,0.471512265455863,0.0526315789473684,NA,NA,sn86061215/1912-04-06/ed-1/seq-6/,0.990571818025805
John 15:13 (KJV),"Greater love hath no man than this, that a man lay down his life for his friends.",http://chroniclingamerica.loc.gov/lccn/sn84023209/1867-07-24/ed-1/seq-1/#words=greater+love+hath+man+than+man+lay+down+life+friends,,yes,no man than man lay,15,0.625,6.01553076063383,0.625,15,4.5898438608156,sn84023209/1867-07-24/ed-1/seq-1/,0
Daniel 4:7 (KJV),"Then came in the magicians, the astrologers, the Chaldeans, and the soothsayers: and I told the dream before them; but they did not make known unto me the interpretation thereof.",http://chroniclingamerica.loc.gov/lccn/sn85038078/1846-05-07/ed-1/seq-2/#words=came+magicians+astrologers+chaldeans+soothsayers+i+told+dream+before+did+make+known+unto+me+interpretation+thereof,,no,them did not,1,0.0238095238095238,0.203649236560791,0.0238095238095238,NA,NA,sn85038078/1846-05-07/ed-1/seq-2/,0.988332244202326
2 Kings 16:19 (KJV),"Now the rest of the acts of Ahaz which he did, are they not written in the book of the chronicles of the kings of Judah?",http://chroniclingamerica.loc.gov/lccn/sn84024827/1903-04-09/ed-1/seq-1/#words=now+rest+acts+ahaz+did+written+book+chronicles+kings+judah,,possibly,which did not,1,0.0714285714285714,0.639909503118671,0.0714285714285714,NA,NA,sn84024827/1903-04-09/ed-1/seq-1/,0.986847858175861
John 5:39 (KJV),Search the scriptures; for in them ye think ye have eternal life: and they are they which testify of me.,http://chroniclingamerica.loc.gov/lccn/sn88078726/1854-09-21/ed-1/seq-1/#words=search+scriptures+ye+think+ye+eternal+life+testify+me,,yes,life which testify me,21,0.777777777777777,7.41737468814806,0.777777777777777,21,6.28868977193334,sn88078726/1854-09-21/ed-1/seq-1/,0
Ruth 1:16 (KJV),"And Ruth said, Intreat me not to leave thee, or to return from following after thee: for whither thou goest, I will go; and where thou lodgest, I will lodge: thy people shall be my people, and thy God my God:",http://chroniclingamerica.loc.gov/lccn/sn85027003/1859-12-08/ed-1/seq-2/#words=ruth+said+intreat+me+leave+thee+return+following+after+thee+whither+thou+goest+i+go+where+thou+lodgest+i+lodge+thy+people+shall+my+people+thy+god+my+god,,yes,whither thou goest go,34,0.515151515151515,4.95553508083117,0.515151515151515,60,19.6602906140023,sn85027003/1859-12-08/ed-1/seq-2/,0
Proverbs 22:2 (KJV),The rich and poor meet together: the LORD is the maker of them all.,http://chroniclingamerica.loc.gov/lccn/sn89058370/1899-04-15/ed-1/seq-2/#words=rich+poor+meet+together+lord+maker+all,,yes,maker them all,15,1,9.62484921701413,1,15,4.5898438608156,sn89058370/1899-04-15/ed-1/seq-2/,0
Luke 14:17 (KJV),"And sent his servant at supper time to say to them that were bidden, Come; for all things are now ready.",http://chroniclingamerica.loc.gov/lccn/sn83016925/1887-03-30/ed-1/seq-4/#words=sent+servant+supper+time+say+were+bidden+come+all+things+now+ready,,yes,come all things now,6,0.222222222222222,2.11092557827607,0.222222222222222,6,2.16024689946929,sn83016925/1887-03-30/ed-1/seq-4/,0
Luke 9:22 (KJV),"Saying, The Son of man must suffer many things, and be rejected of the elders and chief priests and scribes, and be slain, and be raised the third day.",http://chroniclingamerica.loc.gov/lccn/sn85033781/1896-02-26/ed-1/seq-6/#words=saying+son+man+must+suffer+many+things+rejected+elders+chief+priests+scribes+slain+raised+third+day,,possibly,elders chief priests,5,0.131578947368421,1.20149240620164,0.131578947368421,57,25.4007873893704,sn85033781/1896-02-26/ed-1/seq-6/,6.82474646660552e-168
Luke 14:20 (KJV),"And another said, I have married a wife, and therefore I cannot come.",http://chroniclingamerica.loc.gov/lccn/sn78000395/1903-08-15/ed-1/seq-1/#words=another+said+i+married+wife+therefore+i+cannot+come,,possibly,another said have,1,0.0666666666666667,0.616427674407545,0.0666666666666667,NA,NA,sn78000395/1903-08-15/ed-1/seq-1/,0.98983634651844
Mark 16:10 (KJV),"And she went and told them that had been with him, as they mourned and wept.",http://chroniclingamerica.loc.gov/lccn/sn85033535/1874-05-09/ed-1/seq-1/#words=went+told+had+been+mourned+wept,,no,them had been,1,0.0333333333333333,0.597248869577426,0.0666666666666667,NA,NA,sn85033535/1874-05-09/ed-1/seq-1/,0.990910113991568
Mark 7:12 (KJV),And ye suffer him no more to do ought for his father or his mother;,http://chroniclingamerica.loc.gov/lccn/sn84025841/1896-05-23/ed-1/seq-1/#words=ye+suffer+more+ought+father+mother,,possibly,him no more,1,0.0666666666666667,0.570217862370215,0.0666666666666667,NA,NA,sn84025841/1896-05-23/ed-1/seq-1/,0.991544023940249
Hebrews 6:4 (KJV),"For it is impossible for those who were once enlightened, and have tasted of the heavenly gift, and were made partakers of the Holy Ghost,",http://chroniclingamerica.loc.gov/lccn/sn87056248/1865-03-23/ed-1/seq-2/#words=impossible+those+were+once+enlightened+tasted+heavenly+gift+were+made+partakers+holy+ghost,,no,those who were,1,0.00555555555555556,0.268107784006148,0.0277777777777778,NA,NA,sn87056248/1865-03-23/ed-1/seq-2/,0.990833050148836
Mark 15:36 (KJV),"And one ran and filled a spunge full of vinegar, and put it on a reed, and gave him to drink, saying, Let alone; let us see whether Elias will come to take him down.",http://chroniclingamerica.loc.gov/lccn/sn83025718/1866-05-05/ed-1/seq-4/#words=one+ran+filled+spunge+full+vinegar+put+reed+gave+drink+saying+let+alone+let+us+see+whether+elias+come+take+down,,no,let us see,1,0.0166666666666667,0.145593158205786,0.0166666666666667,NA,NA,sn83025718/1866-05-05/ed-1/seq-4/,0.991258038862707
2 Chronicles 24:19 (KJV),"Yet he sent prophets to them, to bring them again unto the LORD; and they testified against them: but they would not give ear.",http://chroniclingamerica.loc.gov/lccn/sn86053573/1883-03-28/ed-1/seq-5/#words=yet+sent+prophets+bring+again+unto+lord+testified+against+would+give+ear,,no,would not give,1,0.0285714285714286,0.255963801247468,0.0285714285714286,NA,NA,sn86053573/1883-03-28/ed-1/seq-5/,0.992133562409708
Acts 19:7 (KJV),And all the men were about twelve.,http://chroniclingamerica.loc.gov/lccn/sn84026912/1913-04-30/ed-1/seq-6/#words=all+men+were+about+twelve,,yes,all men were,1,0.333333333333333,2.91186316411573,0.333333333333333,NA,NA,sn84026912/1913-04-30/ed-1/seq-6/,0.987143152081018
Deuteronomy 5:17 (KJV),Thou shalt not kill.,http://chroniclingamerica.loc.gov/lccn/sn88064181/1914-11-13/ed-1/seq-4/#words=thou+shalt+kill,,yes,thou shalt not kill,2,1,8.73558949234718,1,42,16.5730705262081,sn88064181/1914-11-13/ed-1/seq-4/,6.46258355155046e-60
Mark 12:25 (KJV),"For when they shall rise from the dead, they neither marry, nor are given in marriage; but are as the angels which are in heaven.",http://chroniclingamerica.loc.gov/lccn/sn85033429/1869-08-26/ed-1/seq-4/#words=when+shall+rise+dead+neither+marry+nor+given+marriage+angels+heaven,,yes,neither marry nor given marriage,6,0.222222222222222,1.99082956525809,0.222222222222222,6,2.16024689946929,sn85033429/1869-08-26/ed-1/seq-4/,0
Luke 2:47 (KJV),And all that heard him were astonished at his understanding and answers.,http://chroniclingamerica.loc.gov/lccn/sn88064250/1892-11-19/ed-1/seq-3/#words=all+heard+were+astonished+understanding+answers,,possibly,heard him were,1,0.0833333333333333,0.770534593009431,0.0833333333333333,NA,NA,sn88064250/1892-11-19/ed-1/seq-3/,0.990840301686905
2 Chronicles 18:17 (KJV),"And the king of Israel said to Jehoshaphat, Did I not tell thee that he would not prophesy good unto me, but evil?",http://chroniclingamerica.loc.gov/lccn/sn84023416/1916-10-06/ed-1/seq-3/#words=king+israel+said+jehoshaphat+did+i+tell+thee+would+prophesy+good+unto+me+evil,,no,did not tell,1,0.0285714285714286,0.264183289031805,0.0285714285714286,NA,NA,sn84023416/1916-10-06/ed-1/seq-3/,0.987849082328746
Ezekiel 22:25 (KJV),"There is a conspiracy of her prophets in the midst thereof, like a roaring lion ravening the prey; they have devoured souls; they have taken the treasure and precious things; they have made her many widows in the midst thereof.",http://chroniclingamerica.loc.gov/lccn/sn86063790/1917-03-15/ed-1/seq-8/#words=conspiracy+prophets+midst+thereof+like+roaring+lion+ravening+prey+devoured+souls+taken+treasure+precious+things+made+many+widows+midst+thereof,,no,have made many,1,0.00833333333333333,0.160864670403689,0.0166666666666667,NA,NA,sn86063790/1917-03-15/ed-1/seq-8/,0.988208674092546
Judges 14:18 (KJV),"And the men of the city said unto him on the seventh day before the sun went down, What is sweeter than honey? and what is stronger than a lion? And he said unto them, If ye had not plowed with my heifer, ye had not found out my riddle.",http://chroniclingamerica.loc.gov/lccn/sn82014635/1896-04-16/ed-1/seq-5/#words=men+city+said+unto+seventh+day+before+sun+went+down+what+sweeter+than+honey+what+stronger+than+lion+said+unto+ye+had+plowed+my+heifer+ye+had+found+out+my+riddle,,no,sun went down,1,0.00625,0.10919486865434,0.0125,NA,NA,sn82014635/1896-04-16/ed-1/seq-5/,0.989394795250881
Philippians 4:13 (KJV),I can do all things through Christ which strengtheneth me.,http://chroniclingamerica.loc.gov/lccn/sn94060041/1907-06-29/ed-1/seq-1/#words=i+can+all+things+through+christ+strengtheneth+me,,yes,can all things,7,0.4,4.50421077130329,0.466666666666667,165,61.3879156713778,sn94060041/1907-06-29/ed-1/seq-1/,0
Philemon 1:20 (KJV),"Yea, brother, let me have joy of thee in the Lord: refresh my bowels in the Lord.",http://chroniclingamerica.loc.gov/lccn/sn82015485/1890-09-13/ed-1/seq-1/#words=yea+brother+let+me+joy+thee+lord+refresh+my+bowels+lord,,no,let me have,1,0.0416666666666667,0.402161676009222,0.0416666666666667,NA,NA,sn82015485/1890-09-13/ed-1/seq-1/,0.9877830281626
Matthew 12:50 (KJV),"For whosoever shall do the will of my Father which is in heaven, the same is my brother, and sister, and mother.",http://chroniclingamerica.loc.gov/lccn/sn89058370/1887-11-02/ed-1/seq-3/#words=whosoever+shall+my+father+heaven+same+my+brother+sister+mother,,possibly,brother sister mother,1,0.0588235294117647,0.543906771536069,0.0588235294117647,NA,NA,sn89058370/1887-11-02/ed-1/seq-3/,0.989159550721058
Matthew 26:9 (KJV),"For this ointment might have been sold for much, and given to the poor.",http://chroniclingamerica.loc.gov/lccn/sn84020274/1902-03-09/ed-1/seq-48/#words=ointment+might+been+sold+much+given+poor,,no,might have been,1,0.0222222222222222,0.570217862370215,0.0666666666666667,NA,NA,sn84020274/1902-03-09/ed-1/seq-48/,0.989476742385958
Job 1:21 (KJV),"And said, Naked came I out of my mother's womb, and naked shall I return thither: the LORD gave, and the LORD hath taken away; blessed be the name of the LORD.",http://chroniclingamerica.loc.gov/lccn/sn90059228/1918-01-16/ed-1/seq-1/#words=said+naked+came+i+out+my+mother's+womb+naked+shall+i+return+thither+lord+gave+lord+hath+taken+away+blessed+name+lord,,yes,gave lord hath,10,0.217391304347826,2.08942037248055,0.217391304347826,12,3.75277674973257,sn90059228/1918-01-16/ed-1/seq-1/,0
Numbers 14:18 (KJV),"The LORD is longsuffering, and of great mercy, forgiving iniquity and transgression, and by no means clearing the guilty, visiting the iniquity of the fathers upon the children unto the third and fourth generation.",http://chroniclingamerica.loc.gov/lccn/sn86063790/1917-03-15/ed-1/seq-8/#words=lord+longsuffering+great+mercy+forgiving+iniquity+transgression+means+clearing+guilty+visiting+iniquity+fathers+upon+children+unto+third+fourth+generation,,possibly,children unto third,3,0.0588235294117647,0.513858205432187,0.0588235294117647,3,1.52752523165195,sn86063790/1917-03-15/ed-1/seq-8/,3.44565215755915e-267
Romans 7:19 (KJV),"For the good that I would I do not: but the evil which I would not, that I do.",http://chroniclingamerica.loc.gov/lccn/2013271051/1890-03-01/ed-1/seq-2/#words=good+i+would+i+evil+i+would+i,,possibly,which would not,1,0.0833333333333333,0.727965791028932,0.0833333333333333,NA,NA,2013271051/1890-03-01/ed-1/seq-2/,0.991341056551288
Acts 6:2 (KJV),"Then the twelve called the multitude of the disciples unto them, and said, It is not reason that we should leave the word of God, and serve tables.",http://chroniclingamerica.loc.gov/lccn/sn84022871/1915-12-29/ed-1/seq-3/#words=twelve+called+multitude+disciples+unto+said+reason+we+should+leave+word+god+serve+tables,,possibly,word god serve,3,0.0789473684210526,0.761990544017474,0.0789473684210526,3,1.52752523165195,sn84022871/1915-12-29/ed-1/seq-3/,2.54324470041504e-262
