reference,verse,url,match,likely,most_unusual_phrase,token_count,proportion,tfidf,tf,position_range,position_sd,page,runs_pval
Genesis 23:8 (KJV),"And he communed with them, saying, If it be your mind that I should bury my dead out of my sight; hear me, and intreat for me to Ephron the son of Zohar,",http://chroniclingamerica.loc.gov/lccn/sn83035174/1869-08-11/ed-1/seq-4/#words=communed+saying+your+mind+i+should+bury+my+dead+out+my+sight+hear+me+intreat+me+ephron+son+zohar,,no,out sight hear,1,0.0222222222222222,0.214486227204919,0.0222222222222222,NA,NA,sn83035174/1869-08-11/ed-1/seq-4/,0.989950656294429
Matthew 10:1 (KJV),"And when he had called unto him his twelve disciples, he gave them power against unclean spirits, to cast them out, and to heal all manner of sickness and all manner of disease.",http://chroniclingamerica.loc.gov/lccn/sn94060041/1890-03-15/ed-1/seq-6/#words=when+had+called+unto+twelve+disciples+gave+power+against+unclean+spirits+cast+out+heal+all+manner+sickness+all+manner+disease,,possibly,sickness all manner disease,3,0.0566037735849057,0.523381987704519,0.0566037735849057,3,1.52752523165195,sn94060041/1890-03-15/ed-1/seq-6/,0
Acts 7:58 (KJV),"And cast him out of the city, and stoned him: and the witnesses laid down their clothes at a young man's feet, whose name was Saul.",http://chroniclingamerica.loc.gov/lccn/sn83016925/1887-06-15/ed-1/seq-4/#words=cast+out+city+stoned+witnesses+laid+down+clothes+young+man's+feet+whose+name+saul,,yes,him witnesses laid,24,0.631578947368421,6.03980103487141,0.631578947368421,36,11.6876622673383,sn83016925/1887-06-15/ed-1/seq-4/,0
Job 30:4 (KJV),"Who cut up mallows by the bushes, and juniper roots for their meat.",http://chroniclingamerica.loc.gov/lccn/sn86063758/1909-02-26/ed-1/seq-5/#words=cut+up+mallows+bushes+juniper+roots+meat,,possibly,who cut up,1,0.0666666666666667,0.643458681614756,0.0666666666666667,NA,NA,sn86063758/1909-02-26/ed-1/seq-5/,0.983298690526908
Mark 6:53 (KJV),"And when they had passed over, they came into the land of Gennesaret, and drew to the shore.",http://chroniclingamerica.loc.gov/lccn/sn83032011/1871-03-10/ed-1/seq-3/#words=when+had+passed+over+came+land+gennesaret+drew+shore,,possibly,when had passed,1,0.0555555555555556,0.497707391314522,0.0555555555555556,NA,NA,sn83032011/1871-03-10/ed-1/seq-3/,0.992624762722067
2 Kings 4:18 (KJV),"And when the child was grown, it fell on a day, that he went out to his father to the reapers.",http://chroniclingamerica.loc.gov/lccn/sn86069456/1907-01-18/ed-1/seq-7/#words=when+child+grown+fell+day+went+out+father+reapers,,possibly,day went out,1,0.0555555555555556,0.513689728672954,0.0555555555555556,NA,NA,sn86069456/1907-01-18/ed-1/seq-7/,0.989207259531205
Luke 9:13 (KJV),"But he said unto them, Give ye them to eat. And they said, We have no more but five loaves and two fishes; except we should go and buy meat for all this people.",http://chroniclingamerica.loc.gov/lccn/sn85038145/1875-08-26/ed-1/seq-2/#words=said+unto+give+ye+eat+said+we+more+five+loaves+two+fishes+except+we+should+go+buy+meat+all+people,,no,have no more,1,0.0188679245283019,0.169032698937007,0.0188679245283019,NA,NA,sn85038145/1875-08-26/ed-1/seq-2/,0.990770708630159
Matthew 25:42 (KJV),"For I was an hungred, and ye gave me no meat: I was thirsty, and ye gave me no drink:",http://chroniclingamerica.loc.gov/lccn/sn84024283/1888-02-16/ed-1/seq-5/#words=i+hungred+ye+gave+me+meat+i+thirsty+ye+gave+me+drink,,possibly,gave me no,2,0.0740740740740741,0.663609855086029,0.0740740740740741,0,NA,sn84024283/1888-02-16/ed-1/seq-5/,0.989449176904652
Proverbs 17:1 (KJV),"Better is a dry morsel, and quietness therewith, than an house full of sacrifices with strife.",http://chroniclingamerica.loc.gov/lccn/sn83032195/1874-01-28/ed-1/seq-2/#words=better+dry+morsel+quietness+therewith+than+house+full+sacrifices+strife,,possibly,therewith than house full,3,0.142857142857143,1.37884003203162,0.142857142857143,3,1.52752523165195,sn83032195/1874-01-28/ed-1/seq-2/,0
1 Samuel 25:15 (KJV),"But the men were very good unto us, and we were not hurt, neither missed we any thing, as long as we were conversant with them, when we were in the fields:",http://chroniclingamerica.loc.gov/lccn/sn82014296/1869-04-28/ed-1/seq-4/#words=men+were+very+good+unto+us+we+were+hurt+neither+missed+we+any+thing+long+we+were+conversant+when+we+were+fields,,no,were very good,1,0.0163934426229508,0.158227544659366,0.0163934426229508,NA,NA,sn82014296/1869-04-28/ed-1/seq-4/,0.991605322345073
Acts 27:39 (KJV),"And when it was day, they knew not the land: but they discovered a certain creek with a shore, into the which they were minded, if it were possible, to thrust in the ship.",http://chroniclingamerica.loc.gov/lccn/sn84024738/1861-03-14/ed-1/seq-2/#words=when+day+knew+land+discovered+certain+creek+shore+were+minded+were+possible+thrust+ship,,no,if were possible,1,0.0119047619047619,0.203649236560791,0.0238095238095238,NA,NA,sn84024738/1861-03-14/ed-1/seq-2/,0.992678520137368
Exodus 39:12 (KJV),"And the third row, a ligure, an agate, and an amethyst.",http://chroniclingamerica.loc.gov/lccn/sn87008085/1911-05-25/ed-1/seq-7/#words=third+row+ligure+agate+amethyst,,possibly,ligure agate amethyst,1,0.166666666666667,1.54106918601886,0.166666666666667,NA,NA,sn87008085/1911-05-25/ed-1/seq-7/,0.987102904458831
John 11:21 (KJV),"Then said Martha unto Jesus, Lord, if thou hadst been here, my brother had not died.",http://chroniclingamerica.loc.gov/lccn/sn85033673/1867-04-01/ed-1/seq-1/#words=said+martha+unto+jesus+lord+thou+hadst+been+here+my+brother+had+died,,yes,lord if thou hadst been,11,0.314285714285714,2.89142116152797,0.314285714285714,12,3.75277674973257,sn85033673/1867-04-01/ed-1/seq-1/,0
Proverbs 4:15 (KJV),"Avoid it, pass not by it, turn from it, and pass away.",http://chroniclingamerica.loc.gov/lccn/sn93067790/1872-08-07/ed-1/seq-6/#words=avoid+pass+turn+pass+away,,yes,turn pass away,2,0.222222222222222,2.14486227204919,0.222222222222222,12,8.48528137423857,sn93067790/1872-08-07/ed-1/seq-6/,0.97803756426334
Judges 16:13 (KJV),"And Delilah said unto Samson, Hitherto thou hast mocked me, and told me lies: tell me wherewith thou mightest be bound. And he said unto her, If thou weavest the seven locks of my head with the web.",http://chroniclingamerica.loc.gov/lccn/sn95067647/1908-08-20/ed-1/seq-4/#words=delilah+said+unto+samson+hitherto+thou+hast+mocked+me+told+me+lies+tell+me+wherewith+thou+mightest+bound+said+unto+thou+weavest+seven+locks+my+head+web,,no,me told me,1,0.0144927536231884,0.134006016175553,0.0144927536231884,NA,NA,sn95067647/1908-08-20/ed-1/seq-4/,0.989323829208687
Acts 19:7 (KJV),And all the men were about twelve.,http://chroniclingamerica.loc.gov/lccn/sn84022770/1899-03-31/ed-1/seq-4/#words=all+men+were+about+twelve,,yes,all men were,1,0.333333333333333,2.91186316411573,0.333333333333333,NA,NA,sn84022770/1899-03-31/ed-1/seq-4/,0.988680875251078
Luke 3:13 (KJV),"And he said unto them, Exact no more than that which is appointed you.",http://chroniclingamerica.loc.gov/lccn/sn84023649/1847-07-06/ed-1/seq-1/#words=said+unto+exact+more+than+appointed+you,,possibly,no more than,1,0.0588235294117647,0.543906771536069,0.0588235294117647,NA,NA,sn84023649/1847-07-06/ed-1/seq-1/,0.991243046244803
2 John 1:4 (KJV),"I rejoiced greatly that I found of thy children walking in truth, as we have received a commandment from the Father.",http://chroniclingamerica.loc.gov/lccn/sn84023416/1892-04-29/ed-1/seq-2/#words=i+rejoiced+greatly+i+found+thy+children+walking+truth+we+received+commandment+father,,no,we have received,1,0.037037037037037,0.316787701316786,0.037037037037037,NA,NA,sn84023416/1892-04-29/ed-1/seq-2/,0.988324751796589
Matthew 14:4 (KJV),"For John said unto him, It is not lawful for thee to have her.",http://chroniclingamerica.loc.gov/lccn/sn82014593/1852-02-09/ed-1/seq-2/#words=john+said+unto+lawful+thee,,yes,john said unto him not,7,0.538461538461539,4.97073425362572,0.538461538461539,9,2.93446947694317,sn82014593/1852-02-09/ed-1/seq-2/,0
1 Timothy 1:19 (KJV),"Holding faith, and a good conscience; which some having put away concerning faith have made shipwreck:",http://chroniclingamerica.loc.gov/lccn/sn95067647/1908-01-09/ed-1/seq-3/#words=holding+faith+good+conscience+some+having+put+away+concerning+faith+made+shipwreck,,yes,holding faith good conscience which,21,0.636363636363636,6.12981877577394,0.636363636363636,33,11.1965130626416,sn95067647/1908-01-09/ed-1/seq-3/,0
Exodus 25:39 (KJV),"Of a talent of pure gold shall he make it, with all these vessels.",http://chroniclingamerica.loc.gov/lccn/sn82006687/1908-05-07/ed-1/seq-4/#words=talent+pure+gold+shall+make+all+vessels,,possibly,shall make all,1,0.0833333333333333,0.804323352018445,0.0833333333333333,NA,NA,sn82006687/1908-05-07/ed-1/seq-4/,0.985001092333582
Job 39:6 (KJV),"Whose house I have made the wilderness, and the barren land his dwellings.",http://chroniclingamerica.loc.gov/lccn/sn84026526/1860-04-13/ed-1/seq-1/#words=whose+house+i+made+wilderness+barren+land+dwellings,,possibly,house have made,1,0.0666666666666667,0.616427674407545,0.0666666666666667,NA,NA,sn84026526/1860-04-13/ed-1/seq-1/,0.988772022366481
2 Chronicles 33:10 (KJV),"And the LORD spake to Manasseh, and to his people: but they would not hearken.",http://chroniclingamerica.loc.gov/lccn/sn85032801/1898-10-27/ed-1/seq-10/#words=lord+spake+manasseh+people+would+hearken,,no,people would not,1,0.0454545454545455,0.840583192373925,0.0909090909090909,NA,NA,sn85032801/1898-10-27/ed-1/seq-10/,0.990156946729511
Psalm 147:13 (KJV),For he hath strengthened the bars of thy gates; he hath blessed thy children within thee.,http://chroniclingamerica.loc.gov/lccn/sn86061215/1912-11-30/ed-1/seq-8/#words=hath+strengthened+bars+thy+gates+hath+blessed+thy+children+within+thee,,yes,hath blessed thy children,10,0.416666666666667,4.02161676009222,0.416666666666667,36,10.2198064778373,sn86061215/1912-11-30/ed-1/seq-8/,0
1 Chronicles 24:28 (KJV),"Of Mahli came Eleazar, who had no sons.",http://chroniclingamerica.loc.gov/lccn/sn96086441/1881-02-18/ed-1/seq-2/#words=mahli+came+eleazar+had+sons,,possibly,who had no,1,0.0909090909090909,0.877443656747394,0.0909090909090909,NA,NA,sn96086441/1881-02-18/ed-1/seq-2/,0.993030933540813
Psalm 34:19 (KJV),Many are the afflictions of the righteous: but the LORD delivereth him out of them all.,http://chroniclingamerica.loc.gov/lccn/sn85033964/1884-02-14/ed-1/seq-1/#words=many+afflictions+righteous+lord+delivereth+out+all,,possibly,him out them,1,0.0555555555555556,0.536215568012296,0.0555555555555556,NA,NA,sn85033964/1884-02-14/ed-1/seq-1/,0.991990997113355
2 Chronicles 14:14 (KJV),And they smote all the cities round about Gerar; for the fear of the LORD came upon them: and they spoiled all the cities; for there was exceeding much spoil in them.,http://chroniclingamerica.loc.gov/lccn/sn86072143/1870-07-15/ed-1/seq-2/#words=smote+all+cities+round+about+gerar+fear+lord+came+upon+spoiled+all+cities+exceeding+much+spoil,,no,all cities exceeding,1,0.0227272727272727,0.219360914186849,0.0227272727272727,NA,NA,sn86072143/1870-07-15/ed-1/seq-2/,0.993540472608697
1 Chronicles 9:22 (KJV),"All these which were chosen to be porters in the gates were two hundred and twelve. These were reckoned by their genealogy in their villages, whom David and Samuel the seer did ordain in their set office.",http://chroniclingamerica.loc.gov/lccn/sn85038158/1876-09-21/ed-1/seq-4/#words=all+were+chosen+porters+gates+were+two+hundred+twelve+were+reckoned+genealogy+villages+whom+david+samuel+seer+did+ordain+set+office,,no,all which were,1,0.00520833333333333,0.201080838004611,0.0208333333333333,NA,NA,sn85038158/1876-09-21/ed-1/seq-4/,0.990657520712213
Job 1:21 (KJV),"And said, Naked came I out of my mother's womb, and naked shall I return thither: the LORD gave, and the LORD hath taken away; blessed be the name of the LORD.",http://chroniclingamerica.loc.gov/lccn/sn85032801/1893-12-29/ed-1/seq-8/#words=said+naked+came+i+out+my+mother's+womb+naked+shall+i+return+thither+lord+gave+lord+hath+taken+away+blessed+name+lord,,yes,hath taken away blessed name,16,0.347826086956522,3.33954681242011,0.347826086956522,18,5.43650214343336,sn85032801/1893-12-29/ed-1/seq-8/,0
Romans 7:16 (KJV),"If then I do that which I would not, I consent unto the law that it is good.",http://chroniclingamerica.loc.gov/lccn/sn82006687/1872-01-11/ed-1/seq-2/#words=i+i+would+i+consent+unto+law+good,,possibly,which would not,1,0.0555555555555556,0.485310527352621,0.0555555555555556,NA,NA,sn82006687/1872-01-11/ed-1/seq-2/,0.990070433855794
John 3:3 (KJV),"Jesus answered and said unto him, Verily, verily, I say unto thee, Except a man be born again, he cannot see the kingdom of God.",http://chroniclingamerica.loc.gov/lccn/sn97067613/1901-11-20/ed-1/seq-7/#words=jesus+answered+said+unto+verily+verily+i+say+unto+thee+except+man+born+again+cannot+see+kingdom+god,,yes,again cannot see kingdom god,9,0.264705882352941,2.54298402676129,0.264705882352941,9,2.93446947694317,sn97067613/1901-11-20/ed-1/seq-7/,0
Mark 16:10 (KJV),"And she went and told them that had been with him, as they mourned and wept.",http://chroniclingamerica.loc.gov/lccn/sn88064176/1899-01-28/ed-1/seq-2/#words=went+told+had+been+mourned+wept,,possibly,them had been,1,0.0666666666666667,0.597248869577426,0.0666666666666667,NA,NA,sn88064176/1899-01-28/ed-1/seq-2/,0.98889665196791
Mark 7:24 (KJV),"And from thence he arose, and went into the borders of Tyre and Sidon, and entered into an house, and would have no man know it: but he could not be hid.",http://chroniclingamerica.loc.gov/lccn/sn84026925/1892-01-20/ed-1/seq-2/#words=thence+arose+went+borders+tyre+sidon+entered+house+would+man+know+could+hid,,no,house would have,1,0.0256410256410256,0.247484108313368,0.0256410256410256,NA,NA,sn84026925/1892-01-20/ed-1/seq-2/,0.992354436398132
Proverbs 4:7 (KJV),Wisdom is the principal thing; therefore get wisdom: and with all thy getting get understanding.,http://chroniclingamerica.loc.gov/lccn/sn83016884/1840-04-14/ed-1/seq-1/#words=wisdom+principal+thing+therefore+get+wisdom+all+thy+getting+get+understanding,,possibly,thy getting get,3,0.125,1.20648502802767,0.125,3,1.52752523165195,sn83016884/1840-04-14/ed-1/seq-1/,0
Deuteronomy 27:23 (KJV),"Cursed be he that lieth with his mother in law. And all the people shall say, Amen.",http://chroniclingamerica.loc.gov/lccn/sn85025620/1888-07-19/ed-1/seq-2/#words=cursed+lieth+mother+law+all+people+shall+say+amen,,possibly,mother law all,1,0.0833333333333333,0.804323352018445,0.0833333333333333,NA,NA,sn85025620/1888-07-19/ed-1/seq-2/,0.99158714311346
Acts 26:32 (KJV),"Then said Agrippa unto Festus, This man might have been set at liberty, if he had not appealed unto Caesar.",http://chroniclingamerica.loc.gov/lccn/sn84026925/1890-04-09/ed-1/seq-4/#words=said+agrippa+unto+festus+man+might+been+set+liberty+had+appealed+unto+caesar,,no,might have been,1,0.0024390243902439,0.208616291111054,0.024390243902439,NA,NA,sn84026925/1890-04-09/ed-1/seq-4/,0.992295314615546
John 8:11 (KJV),"She said, No man, Lord. And Jesus said unto her, Neither do I condemn thee: go, and sin no more.",http://chroniclingamerica.loc.gov/lccn/sn97067613/1889-02-07/ed-1/seq-4/#words=said+man+lord+jesus+said+unto+neither+i+condemn+thee+go+sin+more,,yes,sin no more,10,0.28125,2.97289087128417,0.3125,78,23.2847112453167,sn97067613/1889-02-07/ed-1/seq-4/,0
Proverbs 22:6 (KJV),"Train up a child in the way he should go: and when he is old, he will not depart from it.",http://chroniclingamerica.loc.gov/lccn/sn89058248/1897-10-15/ed-1/seq-4/#words=train+up+child+way+should+go+when+old+depart,,possibly,way should go when,3,0.142857142857143,1.37884003203162,0.142857142857143,3,1.52752523165195,sn89058248/1897-10-15/ed-1/seq-4/,0
Mark 2:17 (KJV),"When Jesus heard it, he saith unto them, They that are whole have no need of the physician, but they that are sick: I came not to call the righteous, but sinners to repentance.",http://chroniclingamerica.loc.gov/lccn/sn83032195/1874-02-04/ed-1/seq-1/#words=when+jesus+heard+saith+unto+whole+need+physician+sick+i+came+call+righteous+sinners+repentance,,yes,not call righteous,9,0.214285714285714,1.9608259482777,0.214285714285714,9,2.93446947694317,sn83032195/1874-02-04/ed-1/seq-1/,0
Luke 11:36 (KJV),"If thy whole body therefore be full of light, having no part dark, the whole shall be full of light, as when the bright shining of a candle doth give thee light.",http://chroniclingamerica.loc.gov/lccn/sn85053167/1897-02-03/ed-1/seq-4/#words=thy+whole+body+therefore+full+light+having+part+dark+whole+shall+full+light+when+bright+shining+candle+doth+give+thee+light,,no,full light when,1,0.0169491525423729,0.156718900273105,0.0169491525423729,NA,NA,sn85053167/1897-02-03/ed-1/seq-4/,0.990069280276036
Job 27:6 (KJV),"My righteousness I hold fast, and will not let it go: my heart shall not reproach me so long as I live.",http://chroniclingamerica.loc.gov/lccn/sn84024283/1888-04-26/ed-1/seq-7/#words=my+righteousness+i+hold+fast+let+go+my+heart+shall+reproach+me+so+long+i+live,,no,me so long,1,0.0303030303030303,0.292481218915798,0.0303030303030303,NA,NA,sn84024283/1888-04-26/ed-1/seq-7/,0.990828509182117
Ezra 4:19 (KJV),"And I commanded, and search hath been made, and it is found that this city of old time hath made insurrection against kings, and that rebellion and sedition have been made therein.",http://chroniclingamerica.loc.gov/lccn/sn86088296/1891-08-20/ed-1/seq-6/#words=i+commanded+search+hath+been+made+found+city+old+time+hath+made+insurrection+against+kings+rebellion+sedition+been+made+therein,,no,have been made,1,0.00980392156862745,0.175661432228655,0.0196078431372549,NA,NA,sn86088296/1891-08-20/ed-1/seq-6/,0.989739746114316
Hebrews 2:6 (KJV),"But one in a certain place testified, saying, What is man, that thou art mindful of him? or the son of man, that thou visitest him?",http://chroniclingamerica.loc.gov/lccn/sn85038102/1907-04-05/ed-1/seq-8/#words=one+certain+place+testified+saying+what+man+thou+art+mindful+son+man+thou+visitest,,no,man thou art,1,0.0277777777777778,0.248853695657261,0.0277777777777778,NA,NA,sn85038102/1907-04-05/ed-1/seq-8/,0.988262383686341
Numbers 21:23 (KJV),"And Sihon would not suffer Israel to pass through his border: but Sihon gathered all his people together, and went out against Israel into the wilderness: and he came to Jahaz, and fought against Israel.",http://chroniclingamerica.loc.gov/lccn/sn85053167/1897-02-03/ed-1/seq-4/#words=sihon+would+suffer+israel+pass+through+border+sihon+gathered+all+people+together+went+out+against+israel+wilderness+came+jahaz+fought+against+israel,,no,would not suffer,1,0.0172413793103448,0.15061361193702,0.0172413793103448,NA,NA,sn85053167/1897-02-03/ed-1/seq-4/,0.990069280276036
2 Kings 5:13 (KJV),"And his servants came near, and spake unto him, and said, My father, if the prophet had bid thee do some great thing, wouldest thou not have done it? how much rather then, when he saith to thee, Wash, and be clean?",http://chroniclingamerica.loc.gov/lccn/sn93067846/1911-12-06/ed-1/seq-2/#words=servants+came+near+spake+unto+said+my+father+prophet+had+bid+thee+some+great+thing+wouldest+thou+done+how+much+rather+when+saith+thee+wash+clean,,no,not have done,1,0.0126582278481013,0.11340168409698,0.0126582278481013,NA,NA,sn93067846/1911-12-06/ed-1/seq-2/,0.988541667173961
2 Chronicles 36:11 (KJV),"Zedekiah was one and twenty years old when he began to reign, and reigned eleven years in Jerusalem.",http://chroniclingamerica.loc.gov/lccn/sn89074109/1907-03-07/ed-1/seq-3/#words=zedekiah+one+twenty+years+old+when+began+reign+reigned+eleven+years+jerusalem,,possibly,one years old,1,0.166666666666667,1.42554465592554,0.166666666666667,NA,NA,sn89074109/1907-03-07/ed-1/seq-3/,0.989938678685166
Psalm 103:15 (KJV),"As for man, his days are as grass: as a flower of the field, so he flourisheth.",http://chroniclingamerica.loc.gov/lccn/sn84028820/1856-11-20/ed-1/seq-1/#words=man+days+grass+flower+field+so+flourisheth,,yes,field so flourisheth,12,1,9.65188022422134,1,12,3.75277674973257,sn84028820/1856-11-20/ed-1/seq-1/,0
Acts 2:28 (KJV),Thou hast made known to me the ways of life; thou shalt make me full of joy with thy countenance.,http://chroniclingamerica.loc.gov/lccn/sn83045784/1857-10-10/ed-1/seq-3/#words=thou+hast+made+known+me+ways+life+thou+shalt+make+me+full+joy+thy+countenance,,no,made known me,1,0.0294117647058824,0.283878830124157,0.0294117647058824,NA,NA,sn83045784/1857-10-10/ed-1/seq-3/,0.99303611156508
1 Thessalonians 4:6 (KJV),"That no man go beyond and defraud his brother in any matter: because that the Lord is the avenger of all such, as we also have forewarned you and testified.",http://chroniclingamerica.loc.gov/lccn/sn88064069/1922-04-06/ed-1/seq-1/#words=man+go+beyond+defraud+brother+any+matter+because+lord+avenger+all+we+also+forewarned+you+testified,,no,we also have,1,0.0222222222222222,0.214486227204919,0.0222222222222222,NA,NA,sn88064069/1922-04-06/ed-1/seq-1/,0.985327979624448
Matthew 25:23 (KJV),"His lord said unto him, Well done, good and faithful servant; thou hast been faithful over a few things, I will make thee ruler over many things: enter thou into the joy of thy lord.",http://chroniclingamerica.loc.gov/lccn/sn85033637/1878-11-26/ed-1/seq-1/#words=lord+said+unto+well+done+good+faithful+servant+thou+hast+been+faithful+over+few+things+i+make+thee+ruler+over+many+things+enter+thou+joy+thy+lord,,yes,faithful servant thou hast been,47,0.669117647058823,6.40319537814018,0.691176470588235,60,16.6911345219912,sn85033637/1878-11-26/ed-1/seq-1/,0
Acts 23:13 (KJV),And they were more than forty which had made this conspiracy.,http://chroniclingamerica.loc.gov/lccn/sn85038145/1869-02-04/ed-1/seq-2/#words=were+more+than+forty+had+made+conspiracy,,possibly,were more than,1,0.0909090909090909,0.81443027669649,0.0909090909090909,NA,NA,sn85038145/1869-02-04/ed-1/seq-2/,0.990650788856195
Exodus 34:10 (KJV),"And he said, Behold, I make a covenant: before all thy people I will do marvels, such as have not been done in all the earth, nor in any nation: and all the people among which thou art shall see the work of the LORD: for it is a terrible thing that I will do with thee.",http://chroniclingamerica.loc.gov/lccn/sn84026897/1843-06-21/ed-1/seq-2/#words=said+behold+i+make+covenant+before+all+thy+people+i+marvels+been+done+all+earth+nor+any+nation+all+people+among+thou+art+shall+see+work+lord+terrible+thing+i+thee,,no,have not been,1,0.00574712643678161,0.0983134245465888,0.0114942528735632,NA,NA,sn84026897/1843-06-21/ed-1/seq-2/,0.990039145360352
Proverbs 5:1 (KJV),"My son, attend unto my wisdom, and bow thine ear to my understanding:",http://chroniclingamerica.loc.gov/lccn/sn84024558/1867-05-23/ed-1/seq-1/#words=my+son+attend+unto+my+wisdom+bow+thine+ear+my+understanding,,possibly,bow thine ear,1,0.0666666666666667,0.643458681614756,0.0666666666666667,NA,NA,sn84024558/1867-05-23/ed-1/seq-1/,0.99132879295906
2 Samuel 14:29 (KJV),"Therefore Absalom sent for Joab, to have sent him to the king; but he would not come to him: and when he sent again the second time, he would not come.",http://chroniclingamerica.loc.gov/lccn/sn86091039/1908-12-08/ed-1/seq-1/#words=therefore+absalom+sent+joab+sent+king+would+come+when+sent+again+second+time+would+come,,no,come him when,1,0.0208333333333333,0.201080838004611,0.0208333333333333,NA,NA,sn86091039/1908-12-08/ed-1/seq-1/,0.986568500899358
Jeremiah 34:10 (KJV),"Now when all the princes, and all the people, which had entered into the covenant, heard that every one should let his manservant, and every one his maidservant, go free, that none should serve themselves of them any more, then they obeyed, and let them go.",http://chroniclingamerica.loc.gov/lccn/sn83016811/1888-07-28/ed-1/seq-4/#words=now+when+all+princes+all+people+had+entered+covenant+heard+every+one+should+let+manservant+every+one+maidservant+go+free+none+should+serve+themselves+any+more+obeyed+let+go,,no,every one should,1,0.00574712643678161,0.106280633518542,0.0114942528735632,NA,NA,sn83016811/1888-07-28/ed-1/seq-4/,0.984916909471554
Exodus 20:3 (KJV),Thou shalt have no other gods before me.,http://chroniclingamerica.loc.gov/lccn/sn87065296/1839-09-21/ed-1/seq-1/#words=thou+shalt+other+gods+before+me,,possibly,have no other,1,0.0714285714285714,0.68942001601581,0.0714285714285714,NA,NA,sn87065296/1839-09-21/ed-1/seq-1/,0.987689595159871
1 Timothy 6:6 (KJV),But godliness with contentment is great gain.,http://chroniclingamerica.loc.gov/lccn/sn85038102/1907-02-08/ed-1/seq-5/#words=godliness+contentment+great+gain,,yes,godliness contentment great,3,1,9.65188022422134,1,3,1.52752523165195,sn85038102/1907-02-08/ed-1/seq-5/,9.24765725696049e-245
Luke 13:30 (KJV),"And, behold, there are last which shall be first, and there are first which shall be last.",http://chroniclingamerica.loc.gov/lccn/sn88064176/1899-12-30/ed-1/seq-2/#words=behold+last+shall+first+first+shall+last,,possibly,which shall first,1,0.0555555555555556,0.536215568012296,0.0555555555555556,NA,NA,sn88064176/1899-12-30/ed-1/seq-2/,0.989147524332968
Galatians 3:27 (KJV),For as many of you as have been baptized into Christ have put on Christ.,http://chroniclingamerica.loc.gov/lccn/sn85049554/1903-06-18/ed-1/seq-3/#words=many+you+been+baptized+christ+put+christ,,possibly,many have been,1,0.0666666666666667,0.643458681614756,0.0666666666666667,NA,NA,sn85049554/1903-06-18/ed-1/seq-3/,0.989621951298944
