reference,verse,url,match,likely,most_unusual_phrase,token_count,probability,tfidf,tf,position_range,position_sd,page
Psalm 24:4,"He that hath clean hands, and a pure heart; who hath not lifted up his soul unto vanity, nor sworn deceitfully.",http://chroniclingamerica.loc.gov/lccn/sn85038115/1885-08-25/ed-1/seq-2/#words=hath+clean+hands+pure+heart+hath+lifted+up+soul+unto+vanity+nor+sworn+deceitfully,,possibly,hands pure heart who,3,0.0833333333333333,0.802735538701554,0.0833333333333333,3,1.52752523165195,sn85038115/1885-08-25/ed-1/seq-2/
Esther 1:15,"What shall we do unto the queen Vashti according to law, because she hath not performed the commandment of the king Ahasuerus by the chamberlains?",http://chroniclingamerica.loc.gov/lccn/sn83035102/1857-09-03/ed-1/seq-2/#words=what+shall+we+unto+queen+vashti+according+law+because+hath+performed+commandment+king+ahasuerus+chamberlains,,no,what shall we do,1,0.0256410256410256,0.19710041834265,0.0256410256410256,0,NA,sn83035102/1857-09-03/ed-1/seq-2/
Psalm 104:33,I will sing unto the LORD as long as I live: I will sing praise to my God while I have my being.,http://chroniclingamerica.loc.gov/lccn/sn93067841/1917-11-08/ed-1/seq-4/#words=i+sing+unto+lord+long+i+live+i+sing+praise+my+god+while+i+my+being,,no,as long as live,1,0.0303030303030303,0.279617010797287,0.0303030303030303,0,NA,sn93067841/1917-11-08/ed-1/seq-4/
Luke 2:42,"And when he was twelve years old, they went up to Jerusalem after the custom of the feast.",http://chroniclingamerica.loc.gov/lccn/sn84022135/1887-04-19/ed-1/seq-2/#words=when+twelve+years+old+went+up+jerusalem+after+custom+feast,,possibly,when twelve years old,1,0.0555555555555556,0.535157025801036,0.0555555555555556,0,NA,sn84022135/1887-04-19/ed-1/seq-2/
Matthew 23:30,"And say, If we had been in the days of our fathers, we would not have been partakers with them in the blood of the prophets.",http://chroniclingamerica.loc.gov/lccn/sn82014593/1852-07-13/ed-1/seq-1/#words=say+we+had+been+days+our+fathers+we+would+been+partakers+blood+prophets,,no,would not have been,1,0.00854700854700855,0.246995550369709,0.0256410256410256,0,NA,sn82014593/1852-07-13/ed-1/seq-1/
Mark 16:17,And these signs shall follow them that believe; In my name shall they cast out devils; they shall speak with new tongues;,http://chroniclingamerica.loc.gov/lccn/sn85042461/1894-09-30/ed-1/seq-16/#words=signs+shall+follow+believe+my+name+shall+cast+out+devils+shall+speak+new+tongues,,yes,follow them believe my name shall,24,0.727272727272727,7.00569197412266,0.727272727272727,24,7.1443450831176,sn85042461/1894-09-30/ed-1/seq-16/
Matthew 5:37,"But let your communication be, Yea, yea; Nay, nay: for whatsoever is more than these cometh of evil.",http://chroniclingamerica.loc.gov/lccn/sn86071045/1881-04-27/ed-1/seq-3/#words=let+your+communication+yea+yea+nay+nay+whatsoever+more+than+cometh+evil,,yes,whatsoever more than cometh,12,0.5,4.81641323220933,0.5,12,3.75277674973257,sn86071045/1881-04-27/ed-1/seq-3/
Genesis 28:14,"And thy seed shall be as the dust of the earth, and thou shalt spread abroad to the west, and to the east, and to the north, and to the south: and in thee and in thy seed shall all the families of the earth be blessed.",http://chroniclingamerica.loc.gov/lccn/sn82016419/1874-03-27/ed-1/seq-3/#words=thy+seed+shall+dust+earth+thou+shalt+spread+abroad+west+east+north+south+thee+thy+seed+shall+all+families+earth+blessed,,no,west east north south,1,0.00925925925925926,0.178385675267012,0.0185185185185185,0,NA,sn82016419/1874-03-27/ed-1/seq-3/
2 Kings 23:36,"Jehoiakim was twenty and five years old when he began to reign; and he reigned eleven years in Jerusalem. And his mother's name was Zebudah, the daughter of Pedaiah of Rumah.",http://chroniclingamerica.loc.gov/lccn/sn86053573/1881-05-30/ed-1/seq-4/#words=jehoiakim+twenty+five+years+old+when+began+reign+reigned+eleven+years+jerusalem+mother's+name+zebudah+daughter+pedaiah+rumah,,no,five years old when,1,0.0277777777777778,0.220224399227228,0.0277777777777778,0,NA,sn86053573/1881-05-30/ed-1/seq-4/
Acts of the Apostles 6:15,"And all that sat in the council, looking stedfastly on him, saw his face as it had been the face of an angel.",http://chroniclingamerica.loc.gov/lccn/sn85053308/1910-12-16/ed-1/seq-10/#words=all+sat+council+looking+stedfastly+saw+face+had+been+face+angel,,yes,as had been face angel,9,0.333333333333333,3.21094215480622,0.333333333333333,9,2.93446947694317,sn85053308/1910-12-16/ed-1/seq-10/
2 Chronicles 36:2,"Jehoahaz was twenty and three years old when he began to reign, and he reigned three months in Jerusalem.",http://chroniclingamerica.loc.gov/lccn/sn85033964/1884-02-14/ed-1/seq-1/#words=jehoahaz+twenty+three+years+old+when+began+reign+reigned+three+months+jerusalem,,possibly,twenty three years old,1,0.0555555555555556,0.496648849103261,0.0555555555555556,0,NA,sn85033964/1884-02-14/ed-1/seq-1/
John 10:24,"Then came the Jews round about him, and said unto him, How long dost thou make us to doubt? If thou be the Christ, tell us plainly.",http://chroniclingamerica.loc.gov/lccn/sn84026688/1903-10-29/ed-1/seq-1/#words=came+jews+round+about+said+unto+how+long+dost+thou+make+us+doubt+thou+christ+tell+us+plainly,,possibly,christ tell us plainly,6,0.113207547169811,1.08285837129064,0.113207547169811,6,2.16024689946929,sn84026688/1903-10-29/ed-1/seq-1/
Revelation 22:21,The grace of our Lord Jesus Christ be with you all. Amen.,http://chroniclingamerica.loc.gov/lccn/sn84036256/1921-09-02/ed-1/seq-2/#words=grace+our+lord+jesus+christ+you+all+amen,,yes,our lord jesus christ all,2,0.25,2.11428470895923,0.25,3,1.52752523165195,sn84036256/1921-09-02/ed-1/seq-2/
Ezra 2:35,"The children of Senaah, three thousand and six hundred and thirty.",http://chroniclingamerica.loc.gov/lccn/sn86053634/1882-06-21/ed-1/seq-2/#words=children+senaah+three+thousand+six+hundred+thirty,,possibly,three thousand six hundred,1,0.111111111111111,0.968503970282722,0.111111111111111,0,NA,sn86053634/1882-06-21/ed-1/seq-2/
Luke 13:29,"And they shall come from the east, and from the west, and from the north, and from the south, and shall sit down in the kingdom of God.",http://chroniclingamerica.loc.gov/lccn/sn85033306/1888-03-16/ed-1/seq-1/#words=shall+come+east+west+north+south+shall+sit+down+kingdom+god,,yes,come from east from west,7,0.212121212121212,2.00646636141231,0.212121212121212,21,7.20449595077698,sn85033306/1888-03-16/ed-1/seq-1/
2 Timothy 2:13,"If we believe not, yet he abideth faithful: he cannot deny himself.",http://chroniclingamerica.loc.gov/lccn/sn96091000/1857-03-19/ed-1/seq-2/#words=we+believe+yet+abideth+faithful+cannot+deny+himself,,possibly,we believe not yet,1,0.0555555555555556,0.535157025801036,0.0555555555555556,0,NA,sn96091000/1857-03-19/ed-1/seq-2/
John 5:39,Search the scriptures; for in them ye think ye have eternal life: and they are they which testify of me.,http://chroniclingamerica.loc.gov/lccn/sn84026900/1854-09-06/ed-1/seq-1/#words=search+scriptures+ye+think+ye+eternal+life+testify+me,,yes,search scriptures them ye think ye,21,0.875,8.41182877686182,0.875,21,6.28868977193334,sn84026900/1854-09-06/ed-1/seq-1/
Matthew 23:30,"And say, If we had been in the days of our fathers, we would not have been partakers with them in the blood of the prophets.",http://chroniclingamerica.loc.gov/lccn/sn84023209/1858-07-22/ed-1/seq-4/#words=say+we+had+been+days+our+fathers+we+would+been+partakers+blood+prophets,,no,would not have been,1,0.00854700854700855,0.246995550369709,0.0256410256410256,0,NA,sn84023209/1858-07-22/ed-1/seq-4/
Genesis 43:3,"And Judah spake unto him, saying, The man did solemnly protest unto us, saying, Ye shall not see my face, except your brother be with you.",http://chroniclingamerica.loc.gov/lccn/2010270501/1903-12-11/ed-1/seq-6/#words=judah+spake+unto+saying+man+did+solemnly+protest+unto+us+saying+ye+shall+see+my+face+except+your+brother+you,,no,ye shall not see,1,0.0196078431372549,0.155452517101573,0.0196078431372549,0,NA,2010270501/1903-12-11/ed-1/seq-6/
Psalm 147:13,For he hath strengthened the bars of thy gates; he hath blessed thy children within thee.,http://chroniclingamerica.loc.gov/lccn/sn86061215/1912-11-30/ed-1/seq-8/#words=hath+strengthened+bars+thy+gates+hath+blessed+thy+children+within+thee,,yes,hath blessed thy children,6,0.285714285714286,2.75223613269104,0.285714285714286,6,2.16024689946929,sn86061215/1912-11-30/ed-1/seq-8/
Matthew 24:41,"Two women shall be grinding at the mill; the one shall be taken, and the other left.",http://chroniclingamerica.loc.gov/lccn/sn85033781/1876-07-21/ed-1/seq-3/#words=two+women+shall+grinding+mill+one+shall+taken+other+left,,possibly,shall taken other left,3,0.166666666666667,1.44262698004664,0.166666666666667,3,1.52752523165195,sn85033781/1876-07-21/ed-1/seq-3/
Romans 8:28,"And we know that all things work together for good to them that love God, to them who are the called according to his purpose.",http://chroniclingamerica.loc.gov/lccn/sn84026912/1879-03-06/ed-1/seq-3/#words=we+know+all+things+work+together+good+love+god+called+according+purpose,,possibly,work together good them,3,0.0909090909090909,0.875711496765332,0.0909090909090909,3,1.52752523165195,sn84026912/1879-03-06/ed-1/seq-3/
1 John 2:6,"He that saith he abideth in him ought himself also so to walk, even as he walked.",http://chroniclingamerica.loc.gov/lccn/sn83025779/1920-03-06/ed-1/seq-9/#words=saith+abideth+ought+himself+also+so+walk+even+walked,,possibly,walk even as walked,2,0.0952380952380952,0.917412044230348,0.0952380952380952,12,8.48528137423857,sn83025779/1920-03-06/ed-1/seq-9/
Joshua 8:25,"And so it was, that all that fell that day, both of men and women, were twelve thousand, even all the men of Ai.",http://chroniclingamerica.loc.gov/lccn/sn83025779/1920-06-05/ed-1/seq-6/#words=so+all+fell+day+both+men+women+were+twelve+thousand+even+all+men+ai,,no,both men women were,1,0.0333333333333333,0.321094215480622,0.0333333333333333,0,NA,sn83025779/1920-06-05/ed-1/seq-6/
Exodus 20:16,Thou shalt not bear false witness against thy neighbour.,http://chroniclingamerica.loc.gov/lccn/sn84023963/1909-06-25/ed-1/seq-3/#words=thou+shalt+bear+false+witness+against+thy+neighbour,,possibly,thou shalt not bear,1,0.0666666666666667,0.581102382169633,0.0666666666666667,0,NA,sn84023963/1909-06-25/ed-1/seq-3/
Exodus 36:33,And he made the middle bar to shoot through the boards from the one end to the other.,http://chroniclingamerica.loc.gov/lccn/sn89074109/1914-03-27/ed-1/seq-4/#words=made+middle+bar+shoot+through+boards+one+end+other,,possibly,from one end other,1,0.0555555555555556,0.535157025801036,0.0555555555555556,0,NA,sn89074109/1914-03-27/ed-1/seq-4/
Luke 14:11,For whosoever exalteth himself shall be abased; and he that humbleth himself shall be exalted.,http://chroniclingamerica.loc.gov/lccn/sn88064181/1914-04-03/ed-1/seq-7/#words=whosoever+exalteth+himself+shall+abased+humbleth+himself+shall+exalted,,possibly,humbleth himself shall exalted,1,0.0666666666666667,0.615157423754032,0.0666666666666667,0,NA,sn88064181/1914-04-03/ed-1/seq-7/
Jeremiah 10:11,"Thus shall ye say unto them, The gods that have not made the heavens and the earth, even they shall perish from the earth, and from under these heavens.",http://chroniclingamerica.loc.gov/lccn/sn89066350/1883-04-12/ed-1/seq-1/#words=thus+shall+ye+say+unto+gods+made+heavens+earth+even+shall+perish+earth+under+heavens,,no,shall perish from earth,1,0.0208333333333333,0.192236694923135,0.0208333333333333,0,NA,sn89066350/1883-04-12/ed-1/seq-1/
Luke 3:10,"And the people asked him, saying, What shall we do then?",http://chroniclingamerica.loc.gov/lccn/sn93067846/1897-09-01/ed-1/seq-3/#words=people+asked+saying+what+shall+we,,possibly,what shall we do,1,0.0666666666666667,0.512461087690889,0.0666666666666667,0,NA,sn93067846/1897-09-01/ed-1/seq-3/
Genesis 19:22,"Haste thee, escape thither; for I cannot do any thing till thou be come thither. Therefore the name of the city was called Zoar.",http://chroniclingamerica.loc.gov/lccn/sn85026050/1854-07-14/ed-1/seq-2/#words=haste+thee+escape+thither+i+cannot+any+thing+till+thou+come+thither+therefore+name+city+called+zoar,,no,do any thing till,1,0.0256410256410256,0.246995550369709,0.0256410256410256,0,NA,sn85026050/1854-07-14/ed-1/seq-2/
Joshua 1:5,"There shall not any man be able to stand before thee all the days of thy life: as I was with Moses, so I will be with thee: I will not fail thee, nor forsake thee.",http://chroniclingamerica.loc.gov/lccn/sn84024718/1864-01-26/ed-1/seq-2/#words=shall+any+man+able+stand+before+thee+all+days+thy+life+i+moses+so+i+thee+i+fail+thee+nor+forsake+thee,,possibly,thee not fail thee,9,0.166666666666667,1.48168197133518,0.166666666666667,9,2.93446947694317,sn84024718/1864-01-26/ed-1/seq-2/
Deuteronomy 3:6,"And we utterly destroyed them, as we did unto Sihon king of Heshbon, utterly destroying the men, women, and children, of every city.",http://chroniclingamerica.loc.gov/lccn/sn84038306/1914-10-21/ed-1/seq-2/#words=we+utterly+destroyed+we+did+unto+sihon+king+heshbon+utterly+destroying+men+women+children+every+city,,no,men women children every,1,0.0238095238095238,0.229353011057587,0.0238095238095238,0,NA,sn84038306/1914-10-21/ed-1/seq-2/
Proverbs 27:1,Boast not thyself of to morrow; for thou knowest not what a day may bring forth.,http://chroniclingamerica.loc.gov/lccn/sn84036012/1898-05-03/ed-1/seq-6/#words=boast+thyself+morrow+thou+knowest+what+day+may+bring+forth,,possibly,day may bring forth,3,0.125,1.20410330805233,0.125,3,1.52752523165195,sn84036012/1898-05-03/ed-1/seq-6/
Nehemiah 7:30,"The men of Ramah and Geba, six hundred twenty and one.",http://chroniclingamerica.loc.gov/lccn/sn87075163/1860-01-12/ed-1/seq-3/#words=men+ramah+geba+six+hundred+twenty+one,,possibly,six hundred twenty one,1,0.0555555555555556,1.02526237292339,0.111111111111111,0,NA,sn87075163/1860-01-12/ed-1/seq-3/
Luke 3:10,"And the people asked him, saying, What shall we do then?",http://chroniclingamerica.loc.gov/lccn/sn84025841/1896-11-21/ed-1/seq-4/#words=people+asked+saying+what+shall+we,,possibly,what shall we do,1,0.0666666666666667,0.512461087690889,0.0666666666666667,0,NA,sn84025841/1896-11-21/ed-1/seq-4/
1 Samuel 5:8,"They sent therefore and gathered all the lords of the Philistines unto them, and said, What shall we do with the ark of the God of Israel? And they answered, Let the ark of the God of Israel be carried about unto Gath. And they carried the ark of the God of Israel about thither.",http://chroniclingamerica.loc.gov/lccn/sn97071110/1915-03-25/ed-1/seq-2/#words=sent+therefore+gathered+all+lords+philistines+unto+said+what+shall+we+ark+god+israel+answered+let+ark+god+israel+carried+about+unto+gath+carried+ark+god+israel+about+thither,,no,what shall we do,1,0.0123456790123457,0.0949002014242387,0.0123456790123457,0,NA,sn97071110/1915-03-25/ed-1/seq-2/
Mark 10:45,"For even the Son of man came not to be ministered unto, but to minister, and to give his life a ransom for many.",http://chroniclingamerica.loc.gov/lccn/sn87096037/1920-01-08/ed-1/seq-2/#words=even+son+man+came+ministered+unto+minister+give+life+ransom+many,,no,not ministered unto minister,1,0.0416666666666667,0.38447338984627,0.0416666666666667,0,NA,sn87096037/1920-01-08/ed-1/seq-2/
Matthew 25:40,"And the King shall answer and say unto them, Verily I say unto you, Inasmuch as ye have done it unto one of the least of these my brethren, ye have done it unto me.",http://chroniclingamerica.loc.gov/lccn/sn82015485/1917-12-20/ed-1/seq-4/#words=king+shall+answer+say+unto+verily+i+say+unto+you+inasmuch+ye+done+unto+one+least+my+brethren+ye+done+unto+me,,yes,done unto one least my,13,0.216666666666667,2.06008139341683,0.216666666666667,12,3.75277674973257,sn82015485/1917-12-20/ed-1/seq-4/
Isaiah 65:21,"And they shall build houses, and inhabit them; and they shall plant vineyards, and eat the fruit of them.",http://chroniclingamerica.loc.gov/lccn/sn85033964/1867-08-30/ed-1/seq-4/#words=shall+build+houses+inhabit+shall+plant+vineyards+eat+fruit,,yes,build houses inhabit them,18,0.857142857142857,8.13837950998799,0.857142857142857,18,5.43650214343336,sn85033964/1867-08-30/ed-1/seq-4/
Mark 9:24,"And straightway the father of the child cried out, and said with tears, Lord, I believe; help thou mine unbelief.",http://chroniclingamerica.loc.gov/lccn/sn86071197/1894-01-22/ed-1/seq-7/#words=straightway+father+child+cried+out+said+tears+lord+i+believe+help+thou+mine+unbelief,,yes,believe help thou mine unbelief,6,0.222222222222222,2.14062810320414,0.222222222222222,6,2.16024689946929,sn86071197/1894-01-22/ed-1/seq-7/
Matthew 16:26,"For what is a man profited, if he shall gain the whole world, and lose his own soul? or what shall a man give in exchange for his soul?",http://chroniclingamerica.loc.gov/lccn/sn85038292/1871-08-10/ed-1/seq-1/#words=what+man+profited+shall+gain+whole+world+lose+own+soul+what+shall+man+give+exchange+soul,,possibly,whole world lose own soul,3,0.0769230769230769,0.709797027408499,0.0769230769230769,3,1.52752523165195,sn85038292/1871-08-10/ed-1/seq-1/
John 21:17,"He saith unto him the third time, Simon, son of Jonas, lovest thou me? Peter was grieved because he said unto him the third time, Lovest thou me? And he said unto him, Lord, thou knowest all things; thou knowest that I love thee. Jesus saith unto him, Feed my sheep.",http://chroniclingamerica.loc.gov/lccn/sn84020558/1908-02-10/ed-1/seq-3/#words=saith+unto+third+time+simon+son+jonas+lovest+thou+me+peter+grieved+because+said+unto+third+time+lovest+thou+me+said+unto+lord+thou+knowest+all+things+thou+knowest+i+love+thee+jesus+saith+unto+feed+my+sheep,,yes,all things thou knowest love,24,0.216216216216216,2.00888940091536,0.216216216216216,45,16.775964085992,sn84020558/1908-02-10/ed-1/seq-3/
1 John 1:5,"This then is the message which we have heard of him, and declare unto you, that God is light, and in him is no darkness at all.",http://chroniclingamerica.loc.gov/lccn/sn85033535/1874-06-13/ed-1/seq-2/#words=message+we+heard+declare+unto+you+god+light+darkness+all,,no,which we have heard,1,0.0151515151515152,0.264137446440742,0.0303030303030303,0,NA,sn85033535/1874-06-13/ed-1/seq-2/
Matthew 21:31,"Whether of them twain did the will of his father? They say unto him, The first. Jesus saith unto them, Verily I say unto you, That the publicans and the harlots go into the kingdom of God before you.",http://chroniclingamerica.loc.gov/lccn/sn84024718/1873-02-11/ed-1/seq-2/#words=whether+twain+did+father+say+unto+first+jesus+saith+unto+verily+i+say+unto+you+publicans+harlots+go+kingdom+god+before+you,,possibly,unto them verily say unto,3,0.0555555555555556,0.455959505078517,0.0555555555555556,3,1.52752523165195,sn84024718/1873-02-11/ed-1/seq-2/
Mark 16:15,"And he said unto them, Go ye into all the world, and preach the gospel to every creature.",http://chroniclingamerica.loc.gov/lccn/sn88064249/1919-11-15/ed-1/seq-3/#words=said+unto+go+ye+all+world+preach+gospel+every+creature,,yes,ye all world preach gospel,6,0.285714285714286,2.75223613269104,0.285714285714286,6,2.16024689946929,sn88064249/1919-11-15/ed-1/seq-3/
Psalm 75:7,"But God is the judge: he putteth down one, and setteth up another.",http://chroniclingamerica.loc.gov/lccn/sn84036012/1889-10-15/ed-1/seq-7/#words=god+judge+putteth+down+one+setteth+up+another,,yes,one setteth up another,12,1,9.63282646441865,1,12,3.75277674973257,sn84036012/1889-10-15/ed-1/seq-7/
Matthew 26:11,For ye have the poor always with you; but me ye have not always.,http://chroniclingamerica.loc.gov/lccn/sn89058007/1903-09-04/ed-1/seq-1/#words=ye+poor+always+you+me+ye+always,,yes,ye have poor always,6,0.266666666666667,3.63340812803384,0.4,2232,980.833659020054,sn89058007/1903-09-04/ed-1/seq-1/
Job 21:5,"Mark me, and be astonished, and lay your hand upon your mouth.",http://chroniclingamerica.loc.gov/lccn/sn83016475/1840-05-30/ed-1/seq-2/#words=mark+me+astonished+lay+your+hand+upon+your+mouth,,yes,lay your hand upon your,3,0.2,1.92656529288373,0.2,3,1.52752523165195,sn83016475/1840-05-30/ed-1/seq-2/
Exodus 14:15,"And the LORD said unto Moses, Wherefore criest thou unto me? speak unto the children of Israel, that they go forward:",http://chroniclingamerica.loc.gov/lccn/sn85025584/1858-03-04/ed-1/seq-1/#words=lord+said+unto+moses+wherefore+criest+thou+unto+me+speak+unto+children+israel+go+forward,,possibly,unto children israel go forward,5,0.0806451612903226,1.55368168780946,0.161290322580645,6,2.16024689946929,sn85025584/1858-03-04/ed-1/seq-1/
Job 15:3,Should he reason with unprofitable talk? or with speeches wherewith he can do no good?,http://chroniclingamerica.loc.gov/lccn/sn82000195/1888-10-30/ed-1/seq-3/#words=should+reason+unprofitable+talk+speeches+wherewith+can+good,,possibly,can do no good,1,0.0555555555555556,0.535157025801036,0.0555555555555556,0,NA,sn82000195/1888-10-30/ed-1/seq-3/
Joshua 9:23,"Now therefore ye are cursed, and there shall none of you be freed from being bondmen, and hewers of wood and drawers of water for the house of my God.",http://chroniclingamerica.loc.gov/lccn/sn85026945/1851-04-26/ed-1/seq-2/#words=now+therefore+ye+cursed+shall+none+you+freed+being+bondmen+hewers+wood+drawers+water+house+my+god,,no,hewers wood drawers water,1,0.0256410256410256,0.229222545739967,0.0256410256410256,0,NA,sn85026945/1851-04-26/ed-1/seq-2/
2 Peter 3:12,"Looking for and hasting unto the coming of the day of God, wherein the heavens being on fire shall be dissolved, and the elements shall melt with fervent heat?",http://chroniclingamerica.loc.gov/lccn/sn84024558/1856-08-21/ed-1/seq-1/#words=looking+hasting+unto+coming+day+god+wherein+heavens+being+fire+shall+dissolved+elements+shall+melt+fervent+heat,,possibly,shall melt fervent heat,3,0.0769230769230769,0.709797027408499,0.0769230769230769,3,1.52752523165195,sn84024558/1856-08-21/ed-1/seq-1/
Psalm 116:2,"Because he hath inclined his ear unto me, therefore will I call upon him as long as I live.",http://chroniclingamerica.loc.gov/lccn/sn86081096/1866-05-08/ed-1/seq-1/#words=because+hath+inclined+ear+unto+me+therefore+i+call+upon+long+i+live,,no,him as long as,1,0.0333333333333333,0.321094215480622,0.0333333333333333,0,NA,sn86081096/1866-05-08/ed-1/seq-1/
Deuteronomy 28:36,"The LORD shall bring thee, and thy king which thou shalt set over thee, unto a nation which neither thou nor thy fathers have known; and there shalt thou serve other gods, wood and stone.",http://chroniclingamerica.loc.gov/lccn/sn83025661/1840-04-22/ed-1/seq-1/#words=lord+shall+bring+thee+thy+king+thou+shalt+set+over+thee+unto+nation+neither+thou+nor+thy+fathers+known+shalt+thou+serve+other+gods+wood+stone,,no,lord shall bring thee,1,0.0133333333333333,0.116220476433927,0.0133333333333333,0,NA,sn83025661/1840-04-22/ed-1/seq-1/
"Esther, Greek 7:4","For we are sold, I and my people, to be destroyed, to be slain, and to perish. But if we had been sold for bondmen and bondwomen, I had held my tongue, although the enemy could not countervail the king's damage.",http://chroniclingamerica.loc.gov/lccn/sn85052141/1885-04-24/ed-1/seq-2/#words=we+sold+i+my+people+destroyed+slain+perish+we+had+been+sold+bondmen+bondwomen+i+had+held+my+tongue+although+enemy+could+countervail+king's+damage,,no,if we had been,1,0.0158730158730159,0.14189967117236,0.0158730158730159,0,NA,sn85052141/1885-04-24/ed-1/seq-2/
Genesis 15:9,"And he said unto him, Take me an heifer of three years old, and a she goat of three years old, and a ram of three years old, and a turtledove, and a young pigeon.",http://chroniclingamerica.loc.gov/lccn/sn84026688/1903-01-29/ed-1/seq-1/#words=said+unto+take+me+heifer+three+years+old+goat+three+years+old+ram+three+years+old+turtledove+young+pigeon,,yes,unto him take me heifer,55,0.645833333333333,10.941672611605,1.14583333333333,372,166.619544853756,sn84026688/1903-01-29/ed-1/seq-1/
Proverbs 1:10,"My son, if sinners entice thee, consent thou not.",http://chroniclingamerica.loc.gov/lccn/sn86063623/1901-06-08/ed-1/seq-1/#words=my+son+sinners+entice+thee+consent+thou,,yes,entice thee consent thou not,3,0.2,1.92656529288373,0.2,3,1.52752523165195,sn86063623/1901-06-08/ed-1/seq-1/
Acts of the Apostles 17:31,"Because he hath appointed a day, in the which he will judge the world in righteousness by that man whom he hath ordained; whereof he hath given assurance unto all men, in that he hath raised him from the dead.",http://chroniclingamerica.loc.gov/lccn/sn84028272/1891-11-25/ed-1/seq-7/#words=because+hath+appointed+day+judge+world+righteousness+man+whom+hath+ordained+whereof+hath+given+assurance+unto+all+men+hath+raised+dead,,yes,which judge world righteousness,18,0.3,2.88984793932559,0.3,54,23.3266797236149,sn84028272/1891-11-25/ed-1/seq-7/
Psalm 118:1,O give thanks unto the LORD; for he is good: because his mercy endureth for ever.,http://chroniclingamerica.loc.gov/lccn/sn86061215/1912-11-30/ed-1/seq-8/#words=o+give+thanks+unto+lord+good+because+mercy+endureth+ever,,possibly,o give thanks unto,1,0.0555555555555556,0.445743808443586,0.0555555555555556,0,NA,sn86061215/1912-11-30/ed-1/seq-8/
1 Samuel 25:15,"But the men were very good unto us, and we were not hurt, neither missed we any thing, as long as we were conversant with them, when we were in the fields:",http://chroniclingamerica.loc.gov/lccn/sn84023209/1858-05-27/ed-1/seq-1/#words=men+were+very+good+unto+us+we+were+hurt+neither+missed+we+any+thing+long+we+were+conversant+when+we+were+fields,,no,as long as we,1,0.0151515151515152,0.145951916127555,0.0151515151515152,0,NA,sn84023209/1858-05-27/ed-1/seq-1/
