reference,verse,url,match,likely,most_unusual_phrase,token_count,probability,tfidf,tf,position_range,position_sd,page
Mark 2:17,"When Jesus heard it, he saith unto them, They that are whole have no need of the physician, but they that are sick: I came not to call the righteous, but sinners to repentance.",http://chroniclingamerica.loc.gov/lccn/sn83032195/1874-02-04/ed-1/seq-1/#words=when+jesus+heard+saith+unto+whole+need+physician+sick+i+came+call+righteous+sinners+repentance,,possibly,call righteous sinners repentance,6,0.142857142857143,1.31134490631931,0.142857142857143,6,2.16024689946929,sn83032195/1874-02-04/ed-1/seq-1/
2 Kings 1:10,"And Elijah answered and said to the captain of fifty, If I be a man of God, then let fire come down from heaven, and consume thee and thy fifty. And there came down fire from heaven, and consumed him and his fifty.",http://chroniclingamerica.loc.gov/lccn/sn83032011/1877-11-23/ed-1/seq-4/#words=elijah+answered+said+captain+fifty+i+man+god+let+fire+come+down+heaven+consume+thee+thy+fifty+came+down+fire+heaven+consumed+fifty,,no,down fire from heaven,1,0.0144927536231884,0.139606180643749,0.0144927536231884,0,NA,sn83032011/1877-11-23/ed-1/seq-4/
2 Peter 3:10,"But the day of the Lord will come as a thief in the night; in the which the heavens shall pass away with a great noise, and the elements shall melt with fervent heat, the earth also and the works that are therein shall be burned up.",http://chroniclingamerica.loc.gov/lccn/sn82015387/1898-12-24/ed-1/seq-2/#words=day+lord+come+thief+night+heavens+shall+pass+away+great+noise+elements+shall+melt+fervent+heat+earth+also+works+therein+shall+burned+up,,yes,shall melt fervent heat earth,13,0.206349206349206,1.96841823354156,0.206349206349206,45,13.8596444250833,sn82015387/1898-12-24/ed-1/seq-2/
James 2:20,"But wilt thou know, O vain man, that faith without works is dead?",http://chroniclingamerica.loc.gov/lccn/sn84027008/1873-06-22/ed-1/seq-2/#words=wilt+thou+know+o+vain+man+faith+without+works+dead,,possibly,faith without works dead,1,0.0555555555555556,0.512631186461694,0.0555555555555556,0,NA,sn84027008/1873-06-22/ed-1/seq-2/
Matthew 7:20,Wherefore by their fruits ye shall know them.,http://chroniclingamerica.loc.gov/lccn/sn85053089/1910-04-15/ed-1/seq-4/#words=wherefore+fruits+ye+shall+know,,yes,fruits ye shall know them,3,0.5,4.7488357141913,0.5,3,1.52752523165195,sn85053089/1910-04-15/ed-1/seq-4/
Judges 11:10,"And the elders of Gilead said unto Jephthah, The LORD be witness between us, if we do not so according to thy words.",http://chroniclingamerica.loc.gov/lccn/sn84023649/1847-06-29/ed-1/seq-1/#words=elders+gilead+said+unto+jephthah+lord+witness+between+us+we+so+according+thy+words,,possibly,us if we do not,3,0.0769230769230769,0.709797027408499,0.0769230769230769,3,1.52752523165195,sn84023649/1847-06-29/ed-1/seq-1/
Numbers 8:11,"And Aaron shall offer the Levites before the LORD for an offering of the children of Israel, that they may execute the service of the LORD.",http://chroniclingamerica.loc.gov/lccn/sn83025661/1840-04-22/ed-1/seq-1/#words=aaron+shall+offer+levites+before+lord+offering+children+israel+may+execute+service+lord,,yes,offer levites before lord,9,0.333333333333333,3.21094215480622,0.333333333333333,9,2.93446947694317,sn83025661/1840-04-22/ed-1/seq-1/
Hosea 14:3,"Asshur shall not save us; we will not ride upon horses: neither will we say any more to the work of our hands, Ye are our gods: for in thee the fatherless findeth mercy.",http://chroniclingamerica.loc.gov/lccn/sn85026945/1851-08-29/ed-1/seq-1/#words=asshur+shall+save+us+we+ride+upon+horses+neither+we+say+any+more+work+our+hands+ye+our+gods+thee+fatherless+findeth+mercy,,no,not save us we,1,0.0158730158730159,0.152902007371725,0.0158730158730159,0,NA,sn85026945/1851-08-29/ed-1/seq-1/
Psalm 139:16,"Thine eyes did see my substance, yet being unperfect; and in thy book all my members were written, which in continuance were fashioned, when as yet there was none of them.",http://chroniclingamerica.loc.gov/lccn/sn94060041/1894-03-03/ed-1/seq-1/#words=thine+eyes+did+see+my+substance+yet+being+unperfect+thy+book+all+my+members+were+written+continuance+were+fashioned+when+yet+none,,yes,when as yet none them,36,0.571428571428571,5.50447226538209,0.571428571428571,36,10.5843175395383,sn94060041/1894-03-03/ed-1/seq-1/
Hebrews 2:14,"Forasmuch then as the children are partakers of flesh and blood, he also himself likewise took part of the same; that through death he might destroy him that had the power of death, that is, the devil;",http://chroniclingamerica.loc.gov/lccn/sn97067613/1889-08-29/ed-1/seq-4/#words=forasmuch+children+partakers+flesh+blood+also+himself+likewise+took+part+same+through+death+might+destroy+had+power+death+devil,,possibly,him had power death devil,3,0.0555555555555556,0.535157025801036,0.0555555555555556,3,1.52752523165195,sn97067613/1889-08-29/ed-1/seq-4/
Deuteronomy 2:5,"Meddle not with them; for I will not give you of their land, no, not so much as a foot breadth; because I have given mount Seir unto Esau for a possession.",http://chroniclingamerica.loc.gov/lccn/sn83035143/1865-03-04/ed-1/seq-1/#words=meddle+i+give+you+land+so+much+foot+breadth+because+i+given+mount+seir+unto+esau+possession,,no,not so much as,1,0.0196078431372549,0.159387236620439,0.0196078431372549,0,NA,sn83035143/1865-03-04/ed-1/seq-1/
John 11:29,"As soon as she heard that, she arose quickly, and came unto him.",http://chroniclingamerica.loc.gov/lccn/sn89058248/1895-10-17/ed-1/seq-4/#words=soon+heard+arose+quickly+came+unto,,possibly,as soon as heard,1,0.0666666666666667,0.615157423754032,0.0666666666666667,0,NA,sn89058248/1895-10-17/ed-1/seq-4/
2 Corinthians 10:9,That I may not seem as if I would terrify you by letters.,http://chroniclingamerica.loc.gov/lccn/sn83016632/1879-06-14/ed-1/seq-1/#words=i+may+seem+i+would+terrify+you+letters,,yes,not seem as if would,3,0.25,2.40820661610466,0.25,3,1.52752523165195,sn83016632/1879-06-14/ed-1/seq-1/
Luke 3:10,"And the people asked him, saying, What shall we do then?",http://chroniclingamerica.loc.gov/lccn/sn85042623/1875-01-06/ed-1/seq-1/#words=people+asked+saying+what+shall+we,,possibly,what shall we do,1,0.0666666666666667,0.512461087690889,0.0666666666666667,0,NA,sn85042623/1875-01-06/ed-1/seq-1/
Matthew 23:31,"Wherefore ye be witnesses unto yourselves, that ye are the children of them which killed the prophets.",http://chroniclingamerica.loc.gov/lccn/sn83025661/1840-01-15/ed-1/seq-3/#words=wherefore+ye+witnesses+unto+yourselves+ye+children+killed+prophets,,possibly,ye children them which killed,3,0.142857142857143,1.37611806634552,0.142857142857143,3,1.52752523165195,sn83025661/1840-01-15/ed-1/seq-3/
Luke 8:48,"And he said unto her, Daughter, be of good comfort: thy faith hath made thee whole; go in peace.",http://chroniclingamerica.loc.gov/lccn/sn85033781/1896-04-29/ed-1/seq-6/#words=said+unto+daughter+good+comfort+thy+faith+hath+made+thee+whole+go+peace,,possibly,good comfort thy faith hath,3,0.111111111111111,1.02526237292339,0.111111111111111,3,1.52752523165195,sn85033781/1896-04-29/ed-1/seq-6/
Exodus 14:28,"And the waters returned, and covered the chariots, and the horsemen, and all the host of Pharaoh that came into the sea after them; there remained not so much as one of them.",http://chroniclingamerica.loc.gov/lccn/sn85034235/1883-01-18/ed-1/seq-4/#words=waters+returned+covered+chariots+horsemen+all+host+pharaoh+came+sea+after+remained+so+much+one,,no,not so much as,1,0.0222222222222222,0.180638868169831,0.0222222222222222,0,NA,sn85034235/1883-01-18/ed-1/seq-4/
Acts of the Apostles 4:37,"Having land, sold it, and brought the money, and laid it at the apostles' feet.",http://chroniclingamerica.loc.gov/lccn/sn84023963/1909-02-05/ed-1/seq-6/#words=having+land+sold+brought+money+laid+apostles+feet,,possibly,money laid apostles feet,2,0.166666666666667,1.60547107740311,0.166666666666667,15,10.6066017177982,sn84023963/1909-02-05/ed-1/seq-6/
1 Samuel 15:23,"For rebellion is as the sin of witchcraft, and stubbornness is as iniquity and idolatry. Because thou hast rejected the word of the LORD, he hath also rejected thee from being king.",http://chroniclingamerica.loc.gov/lccn/sn83025779/1920-06-12/ed-1/seq-12/#words=rebellion+sin+witchcraft+stubbornness+iniquity+idolatry+because+thou+hast+rejected+word+lord+hath+also+rejected+thee+being+king,,possibly,hast rejected word lord,3,0.0588235294117647,0.542785962135911,0.0588235294117647,3,1.52752523165195,sn83025779/1920-06-12/ed-1/seq-12/
Genesis 18:33,"And the LORD went his way, as soon as he had left communing with Abraham: and Abraham returned unto his place.",http://chroniclingamerica.loc.gov/lccn/sn82007642/1891-12-03/ed-1/seq-1/#words=lord+went+way+soon+had+left+communing+abraham+abraham+returned+unto+place,,no,as soon as had,1,0.0333333333333333,0.274884403443292,0.0333333333333333,0,NA,sn82007642/1891-12-03/ed-1/seq-1/
Micah 4:2,"And many nations shall come, and say, Come, and let us go up to the mountain of the LORD, and to the house of the God of Jacob; and he will teach us of his ways, and we will walk in his paths: for the law shall go forth of Zion, and the word of the LORD from Jerusalem.",http://chroniclingamerica.loc.gov/lccn/sn84024558/1856-08-21/ed-1/seq-1/#words=many+nations+shall+come+say+come+let+us+go+up+mountain+lord+house+god+jacob+teach+us+ways+we+walk+paths+law+shall+go+forth+zion+word+lord+jerusalem,,no,say come let us,1,0.0128205128205128,0.123497775184854,0.0128205128205128,0,NA,sn84024558/1856-08-21/ed-1/seq-1/
Acts of the Apostles 16:31,"And they said, Believe on the Lord Jesus Christ, and thou shalt be saved, and thy house.",http://chroniclingamerica.loc.gov/lccn/sn86061215/1912-06-01/ed-1/seq-4/#words=said+believe+lord+jesus+christ+thou+shalt+saved+thy+house,,possibly,lord jesus christ thou,1,0.0555555555555556,0.535157025801036,0.0555555555555556,0,NA,sn86061215/1912-06-01/ed-1/seq-4/
Psalm 100:1,"Make a joyful noise unto the LORD, all ye lands.",http://chroniclingamerica.loc.gov/lccn/sn84026925/1879-09-04/ed-1/seq-2/#words=make+joyful+noise+unto+lord+all+ye+lands,,yes,joyful noise unto lord,3,0.25,2.24907807403096,0.25,3,1.52752523165195,sn84026925/1879-09-04/ed-1/seq-2/
1 Samuel 9:2,"And he had a son, whose name was Saul, a choice young man, and a goodly: and there was not among the children of Israel a goodlier person than he: from his shoulders and upward he was higher than any of the people.",http://chroniclingamerica.loc.gov/lccn/sn89058154/1922-06-02/ed-1/seq-3/#words=had+son+whose+name+saul+choice+young+man+goodly+among+children+israel+goodlier+person+than+shoulders+upward+higher+than+any+people,,yes,not among children israel,57,1,9.62571304146938,1,57,16.6288166704564,sn89058154/1922-06-02/ed-1/seq-3/
1 Samuel 15:21,"But the people took of the spoil, sheep and oxen, the chief of the things which should have been utterly destroyed, to sacrifice unto the LORD thy God in Gilgal.",http://chroniclingamerica.loc.gov/lccn/sn93067846/1920-06-09/ed-1/seq-5/#words=people+took+spoil+sheep+oxen+chief+things+should+been+utterly+destroyed+sacrifice+unto+lord+thy+god+gilgal,,no,which should have been,1,0.0227272727272727,0.209712758097966,0.0227272727272727,0,NA,sn93067846/1920-06-09/ed-1/seq-5/
1 Corinthians 10:24,"Let no man seek his own, but every man another's wealth.",http://chroniclingamerica.loc.gov/lccn/sn83040052/1898-03-04/ed-1/seq-4/#words=let+man+seek+own+every+man+another's+wealth,,yes,own every man another's,15,1,9.63282646441865,1,15,4.5898438608156,sn83040052/1898-03-04/ed-1/seq-4/
2 Kings 21:19,"Amon was twenty and two years old when he began to reign, and he reigned two years in Jerusalem. And his mother's name was Meshullemeth, the daughter of Haruz of Jotbah.",http://chroniclingamerica.loc.gov/lccn/sn96090259/1908-01-24/ed-1/seq-1/#words=amon+twenty+two+years+old+when+began+reign+reigned+two+years+jerusalem+mother's+name+meshullemeth+daughter+haruz+jotbah,,possibly,twenty two years old when,3,0.0833333333333333,0.777283018371717,0.0833333333333333,3,1.52752523165195,sn96090259/1908-01-24/ed-1/seq-1/
Acts of the Apostles 7:5,"And he gave him none inheritance in it, no, not so much as to set his foot on: yet he promised that he would give it to him for a possession, and to his seed after him, when as yet he had no child.",http://chroniclingamerica.loc.gov/lccn/sn84023209/1867-01-09/ed-1/seq-2/#words=gave+none+inheritance+so+much+set+foot+yet+promised+would+give+possession+seed+after+when+yet+had+child,,no,not so much as,1,0.0151515151515152,0.123162864661248,0.0151515151515152,0,NA,sn84023209/1867-01-09/ed-1/seq-2/
1 Thessalonians 5:13,And to esteem them very highly in love for their work's sake. And be at peace among yourselves.,http://chroniclingamerica.loc.gov/lccn/sn82005159/1858-01-08/ed-1/seq-3/#words=esteem+very+highly+love+work's+sake+peace+among+yourselves,,yes,very highly love work's sake,9,0.5,4.81641323220932,0.5,9,2.93446947694317,sn82005159/1858-01-08/ed-1/seq-3/
Romans 8:32,"He that spared not his own Son, but delivered him up for us all, how shall he not with him also freely give us all things?",http://chroniclingamerica.loc.gov/lccn/sn94060041/1894-05-12/ed-1/seq-1/#words=spared+own+son+delivered+up+us+all+how+shall+also+freely+give+us+all+things,,yes,up us all how shall,45,1,9.63282646441865,1,45,13.1727833893305,sn94060041/1894-05-12/ed-1/seq-1/
Acts of the Apostles 4:20,For we cannot but speak the things which we have seen and heard.,http://chroniclingamerica.loc.gov/lccn/sn82007023/1878-09-06/ed-1/seq-1/#words=we+cannot+speak+things+we+seen+heard,,possibly,which we have seen,1,0.0666666666666667,0.595978618923914,0.0666666666666667,0,NA,sn82007023/1878-09-06/ed-1/seq-1/
1 Corinthians 15:57,"But thanks be to God, which giveth us the victory through our Lord Jesus Christ.",http://chroniclingamerica.loc.gov/lccn/sn84024558/1867-02-21/ed-1/seq-3/#words=thanks+god+giveth+us+victory+through+our+lord+jesus+christ,,possibly,through our lord jesus,2,0.1,0.893967928385871,0.1,3,1.52752523165195,sn84024558/1867-02-21/ed-1/seq-3/
Revelation 16:15,"Behold, I come as a thief. Blessed is he that watcheth, and keepeth his garments, lest he walk naked, and they see his shame.",http://chroniclingamerica.loc.gov/lccn/sn85025620/1883-03-22/ed-1/seq-2/#words=behold+i+come+thief+blessed+watcheth+keepeth+garments+lest+walk+naked+see+shame,,no,behold come as thief,2,0.037037037037037,0.713542701068048,0.0740740740740741,42,29.698484809835,sn85025620/1883-03-22/ed-1/seq-2/
1 Corinthians 2:13,"Which things also we speak, not in the words which man's wisdom teacheth, but which the Holy Ghost teacheth; comparing spiritual things with spiritual.",http://chroniclingamerica.loc.gov/lccn/sn86053370/1864-06-22/ed-1/seq-4/#words=things+also+we+speak+words+man's+wisdom+teacheth+holy+ghost+teacheth+comparing+spiritual+things+spiritual,,yes,words which man's wisdom teacheth,18,0.4,3.85313058576746,0.4,18,5.43650214343336,sn86053370/1864-06-22/ed-1/seq-4/
Genesis 5:23,And all the days of Enoch were three hundred sixty and five years:,http://chroniclingamerica.loc.gov/lccn/sn94060041/1890-03-15/ed-1/seq-6/#words=all+days+enoch+were+three+hundred+sixty+five+years,,possibly,three hundred sixty five,3,0.0666666666666667,1.92656529288373,0.2,2208,1267.06708583247,sn94060041/1890-03-15/ed-1/seq-6/
Ezekiel 48:16,"And these shall be the measures thereof; the north side four thousand and five hundred, and the south side four thousand and five hundred, and on the east side four thousand and five hundred, and the west side four thousand and five hundred.",http://chroniclingamerica.loc.gov/lccn/sn85027003/1859-06-09/ed-1/seq-2/#words=shall+measures+thereof+north+side+four+thousand+five+hundred+south+side+four+thousand+five+hundred+east+side+four+thousand+five+hundred+west+side+four+thousand+five+hundred,,possibly,four thousand five hundred,4,0.0579710144927536,0.494737053666698,0.0579710144927536,0,NA,sn85027003/1859-06-09/ed-1/seq-2/
1 Corinthians 9:5,"Have we not power to lead about a sister, a wife, as well as other apostles, and as the brethren of the Lord, and Cephas?",http://chroniclingamerica.loc.gov/lccn/sn86063778/1909-12-23/ed-1/seq-6/#words=we+power+lead+about+sister+wife+well+other+apostles+brethren+lord+cephas,,no,as well as other,1,0.0256410256410256,0.246995550369709,0.0256410256410256,0,NA,sn86063778/1909-12-23/ed-1/seq-6/
1 John 3:14,"We know that we have passed from death unto life, because we love the brethren. He that loveth not his brother abideth in death.",http://chroniclingamerica.loc.gov/lccn/sn85034357/1917-07-20/ed-1/seq-3/#words=we+know+we+passed+death+unto+life+because+we+love+brethren+loveth+brother+abideth+death,,no,we know we have,1,0.0238095238095238,0.219699079912154,0.0238095238095238,0,NA,sn85034357/1917-07-20/ed-1/seq-3/
Mark 16:15,"And he said unto them, Go ye into all the world, and preach the gospel to every creature.",http://chroniclingamerica.loc.gov/lccn/sn84026925/1892-08-10/ed-1/seq-1/#words=said+unto+go+ye+all+world+preach+gospel+every+creature,,yes,ye all world preach gospel every,18,0.333333333333333,8.25670839807313,0.857142857142857,3324,1705.55580517764,sn84026925/1892-08-10/ed-1/seq-1/
Nehemiah 7:38,"The children of Senaah, three thousand nine hundred and thirty.",http://chroniclingamerica.loc.gov/lccn/sn82005159/1858-12-24/ed-1/seq-2/#words=children+senaah+three+thousand+nine+hundred+thirty,,possibly,three thousand nine hundred,1,0.111111111111111,1.07031405160207,0.111111111111111,0,NA,sn82005159/1858-12-24/ed-1/seq-2/
Matthew 21:3,"And if any man say ought unto you, ye shall say, The Lord hath need of them; and straightway he will send them.",http://chroniclingamerica.loc.gov/lccn/sn85034235/1910-12-29/ed-1/seq-4/#words=any+man+say+ought+unto+you+ye+shall+say+lord+hath+need+straightway+send,,yes,ought unto ye shall,36,1,9.60230945640009,1,36,10.5843175395383,sn85034235/1910-12-29/ed-1/seq-4/
Matthew 25:13,"Watch therefore, for ye know neither the day nor the hour wherein the Son of man cometh.",http://chroniclingamerica.loc.gov/lccn/sn86081895/1901-01-31/ed-1/seq-7/#words=watch+therefore+ye+know+neither+day+nor+hour+wherein+son+man+cometh,,possibly,day nor hour wherein,2,0.0833333333333333,0.785841159197047,0.0833333333333333,15,10.6066017177982,sn86081895/1901-01-31/ed-1/seq-7/
1 Kings 16:31,"And it came to pass, as if it had been a light thing for him to walk in the sins of Jeroboam the son of Nebat, that he took to wife Jezebel the daughter of Ethbaal king of the Zidonians, and went and served Baal, and worshipped him.",http://chroniclingamerica.loc.gov/lccn/sn84026853/1876-09-20/ed-1/seq-4/#words=came+pass+had+been+light+thing+walk+sins+jeroboam+son+nebat+took+wife+jezebel+daughter+ethbaal+king+zidonians+went+served+baal+worshipped,,no,as if had been,1,0.00378787878787879,0.139808505398644,0.0151515151515152,0,NA,sn84026853/1876-09-20/ed-1/seq-4/
Luke 19:41,"And when he was come near, he beheld the city, and wept over it,",http://chroniclingamerica.loc.gov/lccn/sn83016632/1879-10-11/ed-1/seq-3/#words=when+come+near+beheld+city+wept+over,,possibly,beheld city wept over,1,0.111111111111111,1.07031405160207,0.111111111111111,0,NA,sn83016632/1879-10-11/ed-1/seq-3/
Romans 8:3,"For what the law could not do, in that it was weak through the flesh, God sending his own Son in the likeness of sinful flesh, and for sin, condemned sin in the flesh:",http://chroniclingamerica.loc.gov/lccn/sn84026853/1886-04-28/ed-1/seq-1/#words=what+law+could+weak+through+flesh+god+sending+own+son+likeness+sinful+flesh+sin+condemned+sin+flesh,,possibly,god sending own son,6,0.133333333333333,1.28437686192249,0.133333333333333,6,2.16024689946929,sn84026853/1886-04-28/ed-1/seq-1/
1 Kings 16:31,"And it came to pass, as if it had been a light thing for him to walk in the sins of Jeroboam the son of Nebat, that he took to wife Jezebel the daughter of Ethbaal king of the Zidonians, and went and served Baal, and worshipped him.",http://chroniclingamerica.loc.gov/lccn/sn84026817/1877-02-08/ed-1/seq-1/#words=came+pass+had+been+light+thing+walk+sins+jeroboam+son+nebat+took+wife+jezebel+daughter+ethbaal+king+zidonians+went+served+baal+worshipped,,no,as if had been,1,0.0151515151515152,0.139808505398644,0.0151515151515152,0,NA,sn84026817/1877-02-08/ed-1/seq-1/
Matthew 7:11,"If ye then, being evil, know how to give good gifts unto your children, how much more shall your Father which is in heaven give good things to them that ask him?",http://chroniclingamerica.loc.gov/lccn/sn88064020/1911-03-16/ed-1/seq-4/#words=ye+being+evil+know+how+give+good+gifts+unto+your+children+how+much+more+shall+your+father+heaven+give+good+things+ask,,yes,being evil know how give good,19,0.27536231884058,2.52494570262654,0.27536231884058,39,8.7576199068439,sn88064020/1911-03-16/ed-1/seq-4/
John 15:12,"This is my commandment, That ye love one another, as I have loved you.",http://chroniclingamerica.loc.gov/lccn/sn87065532/1909-02-26/ed-1/seq-2/#words=my+commandment+ye+love+one+another+i+loved+you,,possibly,ye love one another,1,0.0666666666666667,0.581102382169633,0.0666666666666667,0,NA,sn87065532/1909-02-26/ed-1/seq-2/
Psalm 137:6,"If I do not remember thee, let my tongue cleave to the roof of my mouth; if I prefer not Jerusalem above my chief joy.",http://chroniclingamerica.loc.gov/lccn/sn83025661/1840-09-02/ed-1/seq-2/#words=i+remember+thee+let+my+tongue+cleave+roof+my+mouth+i+prefer+jerusalem+above+my+chief+joy,,yes,above my chief joy,33,0.6875,6.62256819428783,0.6875,33,9.72266954237894,sn83025661/1840-09-02/ed-1/seq-2/
Isaiah 48:19,"Thy seed also had been as the sand, and the offspring of thy bowels like the gravel thereof; his name should not have been cut off nor destroyed from before me.",http://chroniclingamerica.loc.gov/lccn/sn85042414/1921-08-11/ed-1/seq-4/#words=thy+seed+also+had+been+sand+offspring+thy+bowels+like+gravel+thereof+name+should+been+cut+off+nor+destroyed+before+me,,no,should not have been,1,0.0158730158730159,0.152902007371725,0.0158730158730159,0,NA,sn85042414/1921-08-11/ed-1/seq-4/
Revelation 10:10,"And I took the little book out of the angel's hand, and ate it up; and it was in my mouth sweet as honey: and as soon as I had eaten it, my belly was bitter.",http://chroniclingamerica.loc.gov/lccn/sn84023416/1916-04-21/ed-1/seq-7/#words=i+took+little+book+out+angel's+hand+ate+up+my+mouth+sweet+honey+soon+i+had+eaten+my+belly+bitter,,no,as soon as had,1,0.0196078431372549,0.161696707907819,0.0196078431372549,0,NA,sn84023416/1916-04-21/ed-1/seq-7/
Genesis 44:16,"And Judah said, What shall we say unto my lord? what shall we speak? or how shall we clear ourselves? God hath found out the iniquity of thy servants: behold, we are my lord's servants, both we, and he also with whom the cup is found.",http://chroniclingamerica.loc.gov/lccn/sn86071065/1844-07-17/ed-1/seq-2/#words=judah+said+what+shall+we+say+unto+my+lord+what+shall+we+speak+how+shall+we+clear+ourselves+god+hath+found+out+iniquity+thy+servants+behold+we+my+lord's+servants+both+we+also+whom+cup+found,,no,what shall we say,1,0.0104166666666667,0.0846744694546081,0.0104166666666667,0,NA,sn86071065/1844-07-17/ed-1/seq-2/
1 Samuel 3:6,"And the LORD called yet again, Samuel. And Samuel arose and went to Eli, and said, Here am I; for thou didst call me. And he answered, I called not, my son; lie down again.",http://chroniclingamerica.loc.gov/lccn/sn85033781/1895-10-25/ed-1/seq-6/#words=lord+called+yet+again+samuel+samuel+arose+went+eli+said+here+am+i+thou+didst+call+me+answered+i+called+my+son+lie+down+again,,no,lord called yet again,1,0.0166666666666667,0.160547107740311,0.0166666666666667,0,NA,sn85033781/1895-10-25/ed-1/seq-6/
Mark 10:23,"And Jesus looked round about, and saith unto his disciples, How hardly shall they that have riches enter into the kingdom of God!",http://chroniclingamerica.loc.gov/lccn/sn85042588/1889-03-29/ed-1/seq-2/#words=jesus+looked+round+about+saith+unto+disciples+how+hardly+shall+riches+enter+kingdom+god,,no,riches enter kingdom god,1,0.0303030303030303,0.270899372238143,0.0303030303030303,0,NA,sn85042588/1889-03-29/ed-1/seq-2/
Numbers 13:32,"And they brought up an evil report of the land which they had searched unto the children of Israel, saying, The land, through which we have gone to search it, is a land that eateth up the inhabitants thereof; and all the people that we saw in it are men of a great stature.",http://chroniclingamerica.loc.gov/lccn/sn93065796/1867-07-30/ed-1/seq-1/#words=brought+up+evil+report+land+had+searched+unto+children+israel+saying+land+through+we+gone+search+land+eateth+up+inhabitants+thereof+all+people+we+saw+men+great+stature,,no,through which we have,1,0.0123456790123457,0.118923783511341,0.0123456790123457,0,NA,sn93065796/1867-07-30/ed-1/seq-1/
Acts of the Apostles 20:35,"I have shewed you all things, how that so labouring ye ought to support the weak, and to remember the words of the Lord Jesus, how he said, It is more blessed to give than to receive.",http://chroniclingamerica.loc.gov/lccn/sn89058128/1889-07-25/ed-1/seq-1/#words=i+shewed+you+all+things+how+so+labouring+ye+ought+support+weak+remember+words+lord+jesus+how+said+more+blessed+give+than+receive,,possibly,more blessed give than receive,3,0.0555555555555556,0.535157025801036,0.0555555555555556,3,1.52752523165195,sn89058128/1889-07-25/ed-1/seq-1/
Matthew 11:3,"And said unto him, Art thou he that should come, or do we look for another?",http://chroniclingamerica.loc.gov/lccn/sn84026688/1903-03-05/ed-1/seq-4/#words=said+unto+art+thou+should+come+we+look+another,,yes,come do we look,12,0.571428571428571,5.47146525678399,0.571428571428571,12,3.75277674973257,sn84026688/1903-03-05/ed-1/seq-4/
