reference,verse,url,match,likely,most_unusual_phrase,token_count,proportion,tfidf,tf,position_range,position_sd,page,runs_pval
Matthew 26:9 (KJV),"For this ointment might have been sold for much, and given to the poor.",http://chroniclingamerica.loc.gov/lccn/sn86063823/1906-10-09/ed-1/seq-1/#words=ointment+might+been+sold+much+given+poor,,possibly,might have been,1,0.0666666666666667,0.570217862370215,0.0666666666666667,NA,NA,sn86063823/1906-10-09/ed-1/seq-1/,0.987778729523159
Psalm 35:14 (KJV),"I behaved myself as though he had been my friend or brother: I bowed down heavily, as one that mourneth for his mother.",http://chroniclingamerica.loc.gov/lccn/sn84026259/1875-03-25/ed-1/seq-1/#words=i+behaved+myself+though+had+been+my+friend+brother+i+bowed+down+heavily+one+mourneth+mother,,no,had been friend,1,0.0333333333333333,0.321729340807378,0.0333333333333333,NA,NA,sn84026259/1875-03-25/ed-1/seq-1/,0.990817583269801
Matthew 7:1 (KJV),"Judge not, that ye be not judged.",http://chroniclingamerica.loc.gov/lccn/sn84028385/1866-03-14/ed-1/seq-1/#words=judge+ye+judged,,yes,ye not judged,6,1,9.51672518818528,1,6,2.16024689946929,sn84028385/1866-03-14/ed-1/seq-1/,0
Romans 7:16 (KJV),"If then I do that which I would not, I consent unto the law that it is good.",http://chroniclingamerica.loc.gov/lccn/sn85025620/1883-03-22/ed-1/seq-2/#words=i+i+would+i+consent+unto+law+good,,possibly,would not consent,1,0.0555555555555556,0.513689728672954,0.0555555555555556,NA,NA,sn85025620/1883-03-22/ed-1/seq-2/,0.992606737417749
Acts 24:20 (KJV),"Or else let these same here say, if they have found any evil doing in me, while I stood before the council,",http://chroniclingamerica.loc.gov/lccn/sn85038158/1877-10-25/ed-1/seq-1/#words=else+let+same+here+say+found+any+evil+doing+me+while+i+stood+before+council,,possibly,if have found any,2,0.0571428571428571,0.551536012812648,0.0571428571428571,3,1.52752523165195,sn85038158/1877-10-25/ed-1/seq-1/,0
Genesis 15:4 (KJV),"And, behold, the word of the LORD came unto him, saying, This shall not be thine heir; but he that shall come forth out of thine own bowels shall be thine heir.",http://chroniclingamerica.loc.gov/lccn/sn84026688/1903-01-29/ed-1/seq-1/#words=behold+word+lord+came+unto+saying+shall+thine+heir+shall+come+forth+out+thine+own+bowels+shall+thine+heir,,yes,thine heir shall,40,0.930232558139535,8.87384649531449,0.930232558139535,195,41.3852720269028,sn84026688/1903-01-29/ed-1/seq-1/,0
Revelation 17:2 (KJV),"With whom the kings of the earth have committed fornication, and the inhabitants of the earth have been made drunk with the wine of her fornication.",http://chroniclingamerica.loc.gov/lccn/sn84024283/1905-05-11/ed-1/seq-5/#words=whom+kings+earth+committed+fornication+inhabitants+earth+been+made+drunk+wine+fornication,,no,have been made,1,0.00505050505050505,0.27147675889883,0.0303030303030303,NA,NA,sn84024283/1905-05-11/ed-1/seq-5/,0.988805226026759
1 Peter 2:18 (KJV),"Servants, be subject to your masters with all fear; not only to the good and gentle, but also to the froward.",http://chroniclingamerica.loc.gov/lccn/sn85038614/1889-08-01/ed-1/seq-4/#words=servants+subject+your+masters+all+fear+only+good+gentle+also+froward,,no,not only good,1,0.037037037037037,0.357477045341531,0.037037037037037,NA,NA,sn85038614/1889-08-01/ed-1/seq-4/,0.991538319649627
Matthew 12:25 (KJV),"And Jesus knew their thoughts, and said unto them, Every kingdom divided against itself is brought to desolation; and every city or house divided against itself shall not stand:",http://chroniclingamerica.loc.gov/lccn/sn84036012/1895-02-18/ed-1/seq-5/#words=jesus+knew+thoughts+said+unto+every+kingdom+divided+against+itself+brought+desolation+every+city+house+divided+against+itself+shall+stand,,possibly,divided against itself,4,0.0727272727272727,0.648660493535799,0.0727272727272727,3,1.52752523165195,sn84036012/1895-02-18/ed-1/seq-5/,4.72047626462544e-286
1 Corinthians 10:6 (KJV),"Now these things were our examples, to the intent we should not lust after evil things, as they also lusted.",http://chroniclingamerica.loc.gov/lccn/sn86089174/1895-07-19/ed-1/seq-2/#words=now+things+were+our+examples+intent+we+should+lust+after+evil+things+also+lusted,,no,we should not,1,0.0277777777777778,0.23759077598759,0.0277777777777778,NA,NA,sn86089174/1895-07-19/ed-1/seq-2/,0.983023092350111
John 8:11 (KJV),"She said, No man, Lord. And Jesus said unto her, Neither do I condemn thee: go, and sin no more.",http://chroniclingamerica.loc.gov/lccn/sn85042459/1883-08-12/ed-1/seq-3/#words=said+man+lord+jesus+said+unto+neither+i+condemn+thee+go+sin+more,,possibly,go sin no more,3,0.09375,0.883202921628252,0.09375,3,1.52752523165195,sn85042459/1883-08-12/ed-1/seq-3/,0
Acts 21:14 (KJV),"And when he would not be persuaded, we ceased, saying, The will of the Lord be done.",http://chroniclingamerica.loc.gov/lccn/sn83035595/1867-12-13/ed-1/seq-1/#words=when+would+persuaded+we+ceased+saying+lord+done,,possibly,would not persuaded,1,0.0555555555555556,0.536215568012296,0.0555555555555556,NA,NA,sn83035595/1867-12-13/ed-1/seq-1/,0.993096973488691
John 1:24 (KJV),And they which were sent were of the Pharisees.,http://chroniclingamerica.loc.gov/lccn/sn85038158/1877-02-01/ed-1/seq-4/#words=were+sent+were+pharisees,,possibly,which were sent,1,0.166666666666667,1.45593158205786,0.166666666666667,NA,NA,sn85038158/1877-02-01/ed-1/seq-4/,0.992617189203895
1 Chronicles 29:16 (KJV),"O LORD our God, all this store that we have prepared to build thee an house for thine holy name cometh of thine hand, and is all thine own.",http://chroniclingamerica.loc.gov/lccn/sn83025293/1864-11-19/ed-1/seq-4/#words=o+lord+our+god+all+store+we+prepared+build+thee+house+thine+holy+name+cometh+thine+hand+all+thine+own,,no,store we have,1,0.0196078431372549,0.189252553416105,0.0196078431372549,NA,NA,sn83025293/1864-11-19/ed-1/seq-4/,0.985016967931096
Luke 2:15 (KJV),"And it came to pass, as the angels were gone away from them into heaven, the shepherds said one to another, Let us now go even unto Bethlehem, and see this thing which is come to pass, which the Lord hath made known unto us.",http://chroniclingamerica.loc.gov/lccn/2010270501/1903-12-11/ed-1/seq-6/#words=came+pass+angels+were+gone+away+heaven+shepherds+said+one+another+let+us+now+go+even+unto+bethlehem+see+thing+come+pass+lord+hath+made+known+unto+us,,yes,angels were gone,62,0.774999999999999,7.38716434948722,0.774999999999999,87,27.1702952086454,2010270501/1903-12-11/ed-1/seq-6/,0
Matthew 6:9 (KJV),"After this manner therefore pray ye: Our Father which art in heaven, Hallowed be thy name.",http://chroniclingamerica.loc.gov/lccn/sn88078726/1854-04-06/ed-1/seq-1/#words=after+manner+therefore+pray+ye+our+father+art+heaven+hallowed+thy+name,,possibly,father which art heaven,6,0.2,1.83969362080758,0.2,6,2.16024689946929,sn88078726/1854-04-06/ed-1/seq-1/,0
Acts 5:30 (KJV),"The God of our fathers raised up Jesus, whom ye slew and hanged on a tree.",http://chroniclingamerica.loc.gov/lccn/sn83045462/1879-07-30/ed-1/seq-4/#words=god+our+fathers+raised+up+jesus+whom+ye+slew+hanged+tree,,yes,fathers raised up,23,1,9.53413891112994,1,24,7.1443450831176,sn83045462/1879-07-30/ed-1/seq-4/,0
Revelation 22:13 (KJV),"I am Alpha and Omega, the beginning and the end, the first and the last.",http://chroniclingamerica.loc.gov/lccn/sn94060041/1894-08-25/ed-1/seq-1/#words=i+am+alpha+omega+beginning+end+first+last,,yes,am alpha omega,3,0.25,2.2210879649725,0.25,3,1.52752523165195,sn94060041/1894-08-25/ed-1/seq-1/,0
Isaiah 1:4 (KJV),"Ah sinful nation, a people laden with iniquity, a seed of evildoers, children that are corrupters: they have forsaken the LORD, they have provoked the Holy One of Israel unto anger, they are gone away backward.",http://chroniclingamerica.loc.gov/lccn/sn83016474/1840-04-02/ed-1/seq-1/#words=ah+sinful+nation+people+laden+iniquity+seed+evildoers+children+corrupters+forsaken+lord+provoked+holy+one+israel+unto+anger+gone+away+backward,,yes,holy one israel unto,41,0.694915254237288,6.67796386855905,0.694915254237288,66,18.6720116372887,sn83016474/1840-04-02/ed-1/seq-1/,0
Matthew 19:8 (KJV),"He saith unto them, Moses because of the hardness of your hearts suffered you to put away your wives: but from the beginning it was not so.",http://chroniclingamerica.loc.gov/lccn/sn84023209/1867-05-08/ed-1/seq-2/#words=saith+unto+moses+because+hardness+your+hearts+suffered+you+put+away+your+wives+beginning+so,,yes,because hardness your hearts suffered,27,0.710526315789473,6.85791489615726,0.710526315789473,27,8.00231448001371,sn84023209/1867-05-08/ed-1/seq-2/,0
2 Timothy 2:15 (KJV),"Study to shew thyself approved unto God, a workman that needeth not to be ashamed, rightly dividing the word of truth.",http://chroniclingamerica.loc.gov/lccn/sn83035565/1913-01-16/ed-1/seq-4/#words=study+shew+thyself+approved+unto+god+workman+needeth+ashamed+rightly+dividing+word+truth,,yes,thyself approved unto god,21,0.545454545454545,6.14210559723176,0.636363636363636,558,207.584520938661,sn83035565/1913-01-16/ed-1/seq-4/,0
Revelation 22:16 (KJV),"I Jesus have sent mine angel to testify unto you these things in the churches. I am the root and the offspring of David, and the bright and morning star.",http://chroniclingamerica.loc.gov/lccn/sn86069620/1899-02-09/ed-1/seq-4/#words=i+jesus+sent+mine+angel+testify+unto+you+things+churches+i+am+root+offspring+david+bright+morning+star,,yes,root offspring david bright morning,12,0.294871794871795,2.96980929976041,0.307692307692308,12,3.75277674973257,sn86069620/1899-02-09/ed-1/seq-4/,0
Luke 15:11 (KJV),"And he said, A certain man had two sons:",http://chroniclingamerica.loc.gov/lccn/sn89058248/1895-03-14/ed-1/seq-1/#words=said+certain+man+had+two+sons,,yes,certain man had,3,0.5,4.57526054598129,0.5,3,1.52752523165195,sn89058248/1895-03-14/ed-1/seq-1/,0
Job 9:35 (KJV),"Then would I speak, and not fear him; but it is not so with me.",http://chroniclingamerica.loc.gov/lccn/sn84026688/1916-12-07/ed-1/seq-1/#words=would+i+speak+fear+so+me,,possibly,him not so,1,0.0555555555555556,0.536215568012296,0.0555555555555556,NA,NA,sn84026688/1916-12-07/ed-1/seq-1/,0.989196877060653
Lamentations 5:6 (KJV),"We have given the hand to the Egyptians, and to the Assyrians, to be satisfied with bread.",http://chroniclingamerica.loc.gov/lccn/sn86053240/1846-12-23/ed-1/seq-1/#words=we+given+hand+egyptians+assyrians+satisfied+bread,,possibly,we have given,1,0.0666666666666667,0.643458681614756,0.0666666666666667,NA,NA,sn86053240/1846-12-23/ed-1/seq-1/,0.98888372815325
1 Corinthians 15:20 (KJV),"But now is Christ risen from the dead, and become the firstfruits of them that slept.",http://chroniclingamerica.loc.gov/lccn/sn82016412/1885-04-06/ed-1/seq-3/#words=now+christ+risen+dead+become+firstfruits+slept,,yes,christ risen dead,7,0.4,4.50421077130329,0.466666666666667,1875,707.678229275478,sn82016412/1885-04-06/ed-1/seq-3/,0
Philemon 1:20 (KJV),"Yea, brother, let me have joy of thee in the Lord: refresh my bowels in the Lord.",http://chroniclingamerica.loc.gov/lccn/sn89081022/1903-01-14/ed-1/seq-6/#words=yea+brother+let+me+joy+thee+lord+refresh+my+bowels+lord,,no,let me have,1,0.0416666666666667,0.402161676009222,0.0416666666666667,NA,NA,sn89081022/1903-01-14/ed-1/seq-6/,0.987445133615643
Acts 13:1 (KJV),"Now there were in the church that was at Antioch certain prophets and teachers; as Barnabas, and Simeon that was called Niger, and Lucius of Cyrene, and Manaen, which had been brought up with Herod the tetrarch, and Saul.",http://chroniclingamerica.loc.gov/lccn/sn87052181/1875-12-16/ed-1/seq-6/#words=now+were+church+antioch+certain+prophets+teachers+barnabas+simeon+called+niger+lucius+cyrene+manaen+had+been+brought+up+herod+tetrarch+saul,,possibly,had been brought up,3,0.0526315789473684,0.486653427163851,0.0526315789473684,3,1.52752523165195,sn87052181/1875-12-16/ed-1/seq-6/,1.85364363978273e-233
Mark 10:15 (KJV),"Verily I say unto you, Whosoever shall not receive the kingdom of God as a little child, he shall not enter therein.",http://chroniclingamerica.loc.gov/lccn/sn85042588/1889-03-29/ed-1/seq-2/#words=verily+i+say+unto+you+whosoever+shall+receive+kingdom+god+little+child+shall+enter+therein,,yes,not enter therein,13,0.433333333333333,4.05166657964836,0.433333333333333,33,10.9861384523971,sn85042588/1889-03-29/ed-1/seq-2/,0
Ezekiel 8:5 (KJV),"Then said he unto me, Son of man, lift up thine eyes now the way toward the north. So I lifted up mine eyes the way toward the north, and behold northward at the gate of the altar this image of jealousy in the entry.",http://chroniclingamerica.loc.gov/lccn/sn94060041/1890-11-15/ed-1/seq-1/#words=said+unto+me+son+man+lift+up+thine+eyes+now+way+toward+north+so+i+lifted+up+mine+eyes+way+toward+north+behold+northward+gate+altar+image+jealousy+entry,,yes,eyes way toward,18,0.203125,2.69558513611968,0.28125,1680,846.611711752318,sn94060041/1890-11-15/ed-1/seq-1/,0
Revelation 21:2 (KJV),"And I John saw the holy city, new Jerusalem, coming down from God out of heaven, prepared as a bride adorned for her husband.",http://chroniclingamerica.loc.gov/lccn/sn83040592/1919-03-28/ed-1/seq-6/#words=i+john+saw+holy+city+new+jerusalem+coming+down+god+out+heaven+prepared+bride+adorned+husband,,yes,down god out heaven,8,0.222222222222222,2.11107351304017,0.222222222222222,792,242.970750738202,sn83040592/1919-03-28/ed-1/seq-6/,0
Matthew 7:12 (KJV),"Therefore all things whatsoever ye would that men should do to you, do ye even so to them: for this is the law and the prophets.",http://chroniclingamerica.loc.gov/lccn/sn84038125/1876-07-21/ed-1/seq-1/#words=therefore+all+things+whatsoever+ye+would+men+should+you+ye+even+so+law+prophets,,yes,whatsoever ye would men,18,0.545454545454545,5.1786541902796,0.545454545454545,18,5.43650214343336,sn84038125/1876-07-21/ed-1/seq-1/,0
Daniel 8:9 (KJV),"And out of one of them came forth a little horn, which waxed exceeding great, toward the south, and toward the east, and toward the pleasant land.",http://chroniclingamerica.loc.gov/lccn/sn89081128/1894-10-10/ed-1/seq-6/#words=out+one+came+forth+little+horn+waxed+exceeding+great+toward+south+toward+east+toward+pleasant+land,,no,one them came,1,0.0222222222222222,0.214486227204919,0.0222222222222222,NA,NA,sn89081128/1894-10-10/ed-1/seq-6/,0.987461421687465
Acts 21:5 (KJV),"And when we had accomplished those days, we departed and went our way; and they all brought us on our way, with wives and children, till we were out of the city: and we kneeled down on the shore, and prayed.",http://chroniclingamerica.loc.gov/lccn/sn82007642/1917-12-20/ed-1/seq-4/#words=when+we+had+accomplished+those+days+we+departed+went+our+way+all+brought+us+our+way+wives+children+till+we+were+out+city+we+kneeled+down+shore+prayed,,no,we were out,1,0.0135135135135135,0.130430813840829,0.0135135135135135,NA,NA,sn82007642/1917-12-20/ed-1/seq-4/,0.989193905132713
Job 31:20 (KJV),"If his loins have not blessed me, and if he were not warmed with the fleece of my sheep;",http://chroniclingamerica.loc.gov/lccn/sn86063790/1917-03-29/ed-1/seq-5/#words=loins+blessed+me+were+warmed+fleece+my+sheep,,no,if were not,1,0.037037037037037,0.331804927543014,0.037037037037037,NA,NA,sn86063790/1917-03-29/ed-1/seq-5/,0.984859993651629
Psalm 119:100 (KJV),"I understand more than the ancients, because I keep thy precepts.",http://chroniclingamerica.loc.gov/lccn/sn88064402/1913-07-11/ed-1/seq-3/#words=i+understand+more+than+ancients+because+i+keep+thy+precepts,,possibly,understand more than,1,0.0666666666666667,0.643458681614756,0.0666666666666667,NA,NA,sn88064402/1913-07-11/ed-1/seq-3/,0.988854483781864
Psalm 81:11 (KJV),But my people would not hearken to my voice; and Israel would none of me.,http://chroniclingamerica.loc.gov/lccn/sn85033964/1884-03-06/ed-1/seq-5/#words=my+people+would+hearken+my+voice+israel+would+none+me,,possibly,people would not,1,0.0588235294117647,0.543906771536069,0.0588235294117647,NA,NA,sn85033964/1884-03-06/ed-1/seq-5/,0.978891893765208
Luke 20:7 (KJV),"And they answered, that they could not tell whence it was.",http://chroniclingamerica.loc.gov/lccn/sn82016352/1901-08-25/ed-1/seq-3/#words=answered+could+tell+whence,,possibly,could not tell,1,0.166666666666667,1.60864670403689,0.166666666666667,NA,NA,sn82016352/1901-08-25/ed-1/seq-3/,0.993270769258985
Leviticus 25:42 (KJV),"For they are my servants, which I brought forth out of the land of Egypt: they shall not be sold as bondmen.",http://chroniclingamerica.loc.gov/lccn/sn84020109/1875-01-07/ed-1/seq-1/#words=my+servants+i+brought+forth+out+land+egypt+shall+sold+bondmen,,possibly,shall not sold,1,0.0625,0.577900944757073,0.0625,NA,NA,sn84020109/1875-01-07/ed-1/seq-1/,0.991035759375884
Colossians 3:21 (KJV),"Fathers, provoke not your children to anger, lest they be discouraged.",http://chroniclingamerica.loc.gov/lccn/sn97067613/1889-12-12/ed-1/seq-3/#words=fathers+provoke+your+children+anger+lest+discouraged,,yes,provoke not your children,9,0.6,5.60976328645942,0.6,9,2.93446947694317,sn97067613/1889-12-12/ed-1/seq-3/,0
Psalm 147:4 (KJV),He telleth the number of the stars; he calleth them all by their names.,http://chroniclingamerica.loc.gov/lccn/sn2006060001/1892-03-25/ed-1/seq-6/#words=telleth+number+stars+calleth+all+names,,yes,stars calleth them all names,9,0.75,7.13754389113896,0.75,9,2.93446947694317,sn2006060001/1892-03-25/ed-1/seq-6/,0
John 12:8 (KJV),For the poor always ye have with you; but me ye have not always.,http://chroniclingamerica.loc.gov/lccn/sn89058007/1903-09-04/ed-1/seq-1/#words=poor+always+ye+you+me+ye+always,,yes,me ye have not always,5,0.294117647058824,2.61107059471758,0.294117647058824,6,2.16024689946929,sn89058007/1903-09-04/ed-1/seq-1/,0
Hebrews 13:6 (KJV),"So that we may boldly say, The Lord is my helper, and I will not fear what man shall do unto me.",http://chroniclingamerica.loc.gov/lccn/sn93067656/1883-11-23/ed-1/seq-3/#words=so+we+may+boldly+say+lord+my+helper+i+fear+what+man+shall+unto+me,,no,so we may,1,0.0185185185185185,0.357477045341531,0.037037037037037,NA,NA,sn93067656/1883-11-23/ed-1/seq-3/,0.981914461299055
Romans 3:18 (KJV),There is no fear of God before their eyes.,http://chroniclingamerica.loc.gov/lccn/sn85038088/1882-06-08/ed-1/seq-1/#words=fear+god+before+eyes,,yes,fear god before,3,0.5,4.62320755805659,0.5,3,1.52752523165195,sn85038088/1882-06-08/ed-1/seq-1/,0
Genesis 7:11 (KJV),"In the six hundredth year of Noah's life, in the second month, the seventeenth day of the month, the same day were all the fountains of the great deep broken up, and the windows of heaven were opened.",http://chroniclingamerica.loc.gov/lccn/sn82014086/1916-03-02/ed-1/seq-4/#words=six+hundredth+year+noah's+life+second+month+seventeenth+day+month+same+day+were+all+fountains+great+deep+broken+up+windows+heaven+were+opened,,no,day were all,1,0.0175438596491228,0.169331232003883,0.0175438596491228,NA,NA,sn82014086/1916-03-02/ed-1/seq-4/,0.990630505637961
Psalm 116:2 (KJV),"Because he hath inclined his ear unto me, therefore will I call upon him as long as I live.",http://chroniclingamerica.loc.gov/lccn/sn83016475/1840-11-14/ed-1/seq-2/#words=because+hath+inclined+ear+unto+me+therefore+i+call+upon+long+i+live,,no,call upon him,1,0.0384615384615385,0.335984211244122,0.0384615384615385,NA,NA,sn83016475/1840-11-14/ed-1/seq-2/,0.990662320287483
Song of Solomon 6:13 (KJV),"Return, return, O Shulamite; return, return, that we may look upon thee. What will ye see in the Shulamite? As it were the company of two armies.",http://chroniclingamerica.loc.gov/lccn/sn84029386/1892-07-28/ed-1/seq-4/#words=return+return+o+shulamite+return+return+we+may+look+upon+thee+what+ye+see+shulamite+were+company+two+armies,,no,we may look,1,0.0238095238095238,0.22980667200527,0.0238095238095238,NA,NA,sn84029386/1892-07-28/ed-1/seq-4/,0.991140811613026
Isaiah 48:19 (KJV),"Thy seed also had been as the sand, and the offspring of thy bowels like the gravel thereof; his name should not have been cut off nor destroyed from before me.",http://chroniclingamerica.loc.gov/lccn/sn82015683/1865-05-11/ed-1/seq-2/#words=thy+seed+also+had+been+sand+offspring+thy+bowels+like+gravel+thereof+name+should+been+cut+off+nor+destroyed+before+me,,no,not have been,1,0.0166666666666667,0.154106918601886,0.0166666666666667,NA,NA,sn82015683/1865-05-11/ed-1/seq-2/,0.991784130844105
Malachi 3:8 (KJV),"Will a man rob God? Yet ye have robbed me. But ye say, Wherein have we robbed thee? In tithes and offerings.",http://chroniclingamerica.loc.gov/lccn/sn86069456/1907-01-11/ed-1/seq-6/#words=man+rob+god+yet+ye+robbed+me+ye+say+wherein+we+robbed+thee+tithes+offerings,,yes,robbed thee tithes offerings,26,0.684210526315789,6.54022415002906,0.684210526315789,39,10.6563785855423,sn86069456/1907-01-11/ed-1/seq-6/,0
Jeremiah 12:14 (KJV),"Thus saith the LORD against all mine evil neighbours, that touch the inheritance which I have caused my people Israel to inherit; Behold, I will pluck them out of their land, and pluck out the house of Judah from among them.",http://chroniclingamerica.loc.gov/lccn/sn87062234/1900-12-11/ed-1/seq-6/#words=thus+saith+lord+against+all+mine+evil+neighbours+touch+inheritance+i+caused+my+people+israel+inherit+behold+i+pluck+out+land+pluck+out+house+judah+among,,no,which have caused,1,0.0142857142857143,0.137884003203162,0.0142857142857143,NA,NA,sn87062234/1900-12-11/ed-1/seq-6/,0.993428725889272
John 12:1 (KJV),"Then Jesus six days before the passover came to Bethany, where Lazarus was which had been dead, whom he raised from the dead.",http://chroniclingamerica.loc.gov/lccn/sn85038158/1877-09-20/ed-1/seq-2/#words=jesus+six+days+before+passover+came+bethany+where+lazarus+had+been+dead+whom+raised+dead,,no,which had been,1,0.00284900284900285,0.219314562450083,0.0256410256410256,NA,NA,sn85038158/1877-09-20/ed-1/seq-2/,0.992507162734767
Deuteronomy 34:7 (KJV),"And Moses was an hundred and twenty years old when he died: his eye was not dim, nor his natural force abated.",http://chroniclingamerica.loc.gov/lccn/sn85034357/1901-08-16/ed-1/seq-1/#words=moses+hundred+twenty+years+old+when+died+eye+dim+nor+natural+force+abated,,possibly,years old when died,2,0.0769230769230769,0.689133311050876,0.0769230769230769,3,1.52752523165195,sn85034357/1901-08-16/ed-1/seq-1/,3.06161652698945e-236
Exodus 8:18 (KJV),"And the magicians did so with their enchantments to bring forth lice, but they could not: so there were lice upon man, and upon beast.",http://chroniclingamerica.loc.gov/lccn/sn84028645/1866-10-11/ed-1/seq-1/#words=magicians+did+so+enchantments+bring+forth+lice+could+so+were+lice+upon+man+upon+beast,,no,could not so,1,0.0256410256410256,0.237087567079825,0.0256410256410256,NA,NA,sn84028645/1866-10-11/ed-1/seq-1/,0.990295524517778
Mark 16:18 (KJV),"They shall take up serpents; and if they drink any deadly thing, it shall not hurt them; they shall lay hands on the sick, and they shall recover.",http://chroniclingamerica.loc.gov/lccn/sn85042461/1894-09-30/ed-1/seq-16/#words=shall+take+up+serpents+drink+any+deadly+thing+shall+hurt+shall+lay+hands+sick+shall+recover,,yes,any deadly thing shall not,13,0.270833333333333,2.59116313804603,0.270833333333333,24,6.0574175761877,sn85042461/1894-09-30/ed-1/seq-16/,0
1 Peter 2:23 (KJV),"Who, when he was reviled, reviled not again; when he suffered, he threatened not; but committed himself to him that judgeth righteously:",http://chroniclingamerica.loc.gov/lccn/sn87091222/1891-12-25/ed-1/seq-6/#words=when+reviled+reviled+again+when+suffered+threatened+committed+himself+judgeth+righteously,,no,not again when,1,0.0277777777777778,0.268107784006148,0.0277777777777778,NA,NA,sn87091222/1891-12-25/ed-1/seq-6/,0.990661360964185
Matthew 20:5 (KJV),"Again he went out about the sixth and ninth hour, and did likewise.",http://chroniclingamerica.loc.gov/lccn/sn96090256/1889-08-30/ed-1/seq-3/#words=again+went+out+about+sixth+ninth+hour+did+likewise,,possibly,went out about,1,0.0555555555555556,0.513689728672954,0.0555555555555556,NA,NA,sn96090256/1889-08-30/ed-1/seq-3/,0.990085393903414
1 Corinthians 16:13 (KJV),"Watch ye, stand fast in the faith, quit you like men, be strong.",http://chroniclingamerica.loc.gov/lccn/sn89067274/1895-06-13/ed-1/seq-1/#words=watch+ye+stand+fast+faith+quit+you+like+men+strong,,yes,stand fast faith,8,0.388888888888889,4.2388195034387,0.444444444444445,4716,1673.22177998017,sn89067274/1895-06-13/ed-1/seq-1/,0
2 Kings 24:9 (KJV),"And he did that which was evil in the sight of the LORD, according to all that his father had done.",http://chroniclingamerica.loc.gov/lccn/sn85052141/1874-07-04/ed-1/seq-1/#words=did+evil+sight+lord+according+all+father+had+done,,possibly,father had done,1,0.0909090909090909,0.777569812323021,0.0909090909090909,NA,NA,sn85052141/1874-07-04/ed-1/seq-1/,0.992719326239837
Jeremiah 17:9 (KJV),"The heart is deceitful above all things, and desperately wicked: who can know it?",http://chroniclingamerica.loc.gov/lccn/sn84026853/1886-11-10/ed-1/seq-5/#words=heart+deceitful+above+all+things+desperately+wicked+can+know,,yes,things desperately wicked,9,0.428571428571429,4.0842052252059,0.428571428571429,9,2.93446947694317,sn84026853/1886-11-10/ed-1/seq-5/,0
Luke 14:6 (KJV),And they could not answer him again to these things.,http://chroniclingamerica.loc.gov/lccn/sn95077631/1894-07-25/ed-1/seq-4/#words=could+answer+again+things,,possibly,could not answer,1,0.111111111111111,0.995414782629043,0.111111111111111,NA,NA,sn95077631/1894-07-25/ed-1/seq-4/,0.990759574589778
Matthew 26:70 (KJV),"But he denied before them all, saying, I know not what thou sayest.",http://chroniclingamerica.loc.gov/lccn/sn90061052/1922-08-31/ed-1/seq-6/#words=denied+before+all+saying+i+know+what+thou+sayest,,possibly,before them all,1,0.0555555555555556,0.485310527352621,0.0555555555555556,NA,NA,sn90061052/1922-08-31/ed-1/seq-6/,0.984229908419795
